전공,2020.04.09.,[영상]온라인 강의 부실사례 '수두룩'...등록금 환불↑,"머니투데이 권현수 임홍조 기자  국내 대학들이 코로나19 확산 예방을 위해 비대면 수업을 실시하는 가운데 온라인 강의 부실사례가 연이어 등장하면서 대학생의 등록금 환불 목소리가 커지고 있다. 지난달 16일 충북 소재 한 대학수업에서는 유튜브 실시간 중계 도중 일베 회원으로 추정되는 네티즌이 접속해 이만희 출석했습니다, 야 나 인데 너 좋아했다 등 수업내용과 관계 없는 댓글을 수차례 달았다.  같은 날 금오공대의 한 온라인 수업에도 시속 523로 봉하산에서 떨어지면 죽나요 등 고故 노무현 대통령을 조롱하는 댓글이 달렸다. 또한 지난달 25일 한국외대 한 교수는 음란물 영상을 타인에게 전송하는 카카오톡 대화창을 온라인 강의 중 실수로 띄워 학생들의 공분을 샀다. 논란이 커지자 한국외대는 해당 수업의 교수를 교체하고, 사건 경위를 조사해 징계 여부를 결정할 예정이다. 이 외에도 최근에는 고려대 한 교수가 16년 전 녹화한 교양강의 수업을 현재 진행 중인 전공수업에 그대로 사용해 학생들의 반발을 샀다. 이 영상은 특정 사이트에서 3만 9000원만 내면 누구나 볼 수 있는 자료다. 대학생들은 등록금 환불을 요구하고 나섰다. 지난 1일 대학생단체 코로나 대학생119는 학생의 입학금과 등록금 환불을 촉구하는 내용의 기자회견을 열기도 했다. 서울 소재 대학에 재학 중인 대학생 씨는 온라인 강의의 질 저하 우려가 현실화됐다면서 수준 낮은 인터넷 강의를 300만 원씩 내고 듣는 격이다. 대학들은 비대면 강의 시수에 따른 등록금 일부를 환불해야 한다고 설명했다.  국내 대학들, 올해 1학기 온라인 강의 전면 대체 움직임 코로나19가 장기화 조짐을 보이자 최근 이화여대를 시작으로 건국대, 숭실대는 올해 1학기 수업을 전부 온라인 강의로 진행키로 결정했다. 건국대는 교무위원회 회의를 통해 온라인 강의 종료 시점을 종강일인 오는 6월 26일로 미뤘다. 숭실대도 오는 13일부터 대면 수업을 실시할 예정이었지만, 코로나19 확산 방지를 위해 올해 1학기 수업을 전면 온라인 수업으로 대체했다. 또한 서울대와 성신여대, 한국외대, 성균관대, 서울여대 등은 코로나19 종식 시점까지 온라인 강의기간을 무기한 연장했다. 사실상 올해 1학기 전체 온라인 강의 수순을 밟을 것으로 분석된다. 이를 감안하면 등록금 환불 문제를 둘러싼 대학과 학생 간의 갈등도 당분간 지속될 전망이다. 경기도 소재 대학에 재학 중인 대학생 씨는 온라인과 오프라인 강의의 가격은 엄연히 다르다면서 국내 주요 대학들이 1학기 전체 온라인 강의 대체를 선언한 만큼, 등록금 환불 문제는 반드시 논의돼야 한다고 강조했다.  권현수 임홍조 기자  줄리아 투자노트 조 변호사의 가정상담소   머니투데이 구독하기   저작권자 ⓒ 돈이 보이는 리얼타임 뉴스 머니투데이,"
전공,2020.04.12.,[취업걱정없는 명품학교]<226>대중금속공업고등학교,"대중금속공업고등학교는 1978년 국영기업 대한중석에서 국내 최초 금속 분야 특수목적 고등학교를 목표로 설립한 명문 특성화고다. 40여년이 넘는 기간 동안 졸업생 8130명을 배출, 대한민국 현장 곳곳에서 산업발전의 중추적인 기술인재로 활동하고 있다. 특히, 대한민국 명장 5명이 대중금속공업고를 졸업했다. 대중금속공업고등학교 전경. 대중금속공업고는 학년별로 체계화된 취업연계 교육 프로그램을 갖췄다. 1학년은 기계계열로 입학해 1년간 정밀기계과, 자동화기계과, 금형기계과를 순환하며 교육실습을 받는다. 2학년은 전공학과를 선택하게 된다. 1년간 전공학과 순환 수업, 실습 경험을 바탕으로 학생의 소질과 적성에 맞는 전공학과를 선택할 수 있다. 그 결과 학업 능률 향상과 자격증 취득률, 취업률 제고 등에서 성과를 내며 학생과 학부모에게 좋은 반응을 얻고 있다. 또 4차 산업혁명에 능동적으로 대응할 수 있는 인성과 기술을 두루 갖춘 융합형 인재를 만드는 맞춤형 교육과정 덕분에 지역사회 신망이 두터운 학교로 자리 잡았다. 대증금속공업고는 학생 취업 역량 강화를 위해 중소기업 특성화고 인력양성사업, 산학일체형 도제학교, 과정평가형 자격과정, 대구광역시 맞춤형 인력양성사업 등을 운영 중이다. 중소벤처기업부와 교육부 지원으로 기업과 학교가 취업확정 협약을 맺고 현장 맞춤형 교육 후 취업까지 연결하고 있다. 산학일체형 도제학교이하 도제반는 1학년 때 기계계열 공통과정을 마친 후, 2학년 학과 선택 시 누구나 도제반을 지원할 수 있다. 합격자는 2, 3학년에 산업현장에서 경험을 쌓아 졸업과 동시에 기업체 취업으로 연결한다. 이밖에도 과정평가형 자격과정, 지역구 맞춤형 인력양성사업 등 다양한 취업 관련 프로그램을 운영하고 있다. 사제동행 풋살동아리 대중아트싸커. 학교 특색사업으로 선취업·후진학 진로프로그램 322 시스템을 구축 운영한다. 졸업과 동시에 산업체에 먼저 취업해 직장생활을 하면서 2년 과정인 사이버대학 또는 일학습병행, 야간대학 과정에서 2년간 수학하면 대구대와 금오공대 34학년 과정인 계약학과로 진학해 학위를 취득하는 과정이다. 대구지역 특성화고 중 유일하게 전국단위모집 학교로 최신식 기숙사를 운영하는 것도 자랑거리다. 특히 공무원, 공기업, 대기업, 기숙사 취업특별반 등을 구성해 기술 영재의 꿈 터로 운영한다. 요일별 독서활동, 체육활동, 분기별 기숙사 체육대회 등 단체생활 속에서 선후배가 사랑과 협력으로 배우고 실천하는 문화를 조성하고 있다. 최근에는 직업계고 재구조화 사업을 추진하고 있다. 학령인구 감소, 노동 시장의 급변 등 주변 환경 변화를 고려해 중장기 발전계획과 연계한 학과 개편과 내실화를 꾀하고 있다. 4차 산업혁명 및 서비스 중심 사회로 변화하는 직업사회에 능동적으로 대응하기 위해 미래로 가는 특성화고를 준비 중이다. 김병부 대중금속공업고 교장은 “취업 준비 능력, 업무 수행 능력이 향상된 우수 전문 기능인을 양성하겠다”면서 “우수 졸업생 배출로 지역 사회와 경제 발전에 기여하는 학교가 되도록 교직원 모두가 화합하겠다”고 밝혔다. 조정형기자    .  네이버 홈에서 전자신문 구독하기  전자신문 바로가기      ⓒ 전자신문  전자신문인터넷,"
전공,2020.04.15.,'학교비정규직·대학강사'출신 국회의원 나올까…교육계 '관심',"학교비정규직 4명 대학강사 2명 출마…교사 2명 교육계 인사 38명 중 27명은 전·현직 대학교수 국회  본회의 모습. 뉴스1   ©   1 허경 기자 서울뉴스1 권형진 기자  학교비정규직, 대학 시간강사가 금배지를 달고 국회에 입성할 수 있을까.  15일 치러지는 제21대 국회의원 총선거4·15총선에서는 교육계에서 소외받던 분야의 인사들이 출마해 관심이 쏠린다.  지금까지 교육계 출신 국회의원이라고 하면 대부분 대학교수 출신이었다. 4·15 총선에서는 학교급식, 교무행정 등 학교비정규직으로 근무하는 4명이 지역구 공천과 비례대표 추천을 받아 국회 입성을 노린다.  학교비정규직 출신 인사는 모두 민중당 간판을 달고 국회의원에 도전한다. 부산 사하구을에 출마하는 김진주44 전국학교비정규직노동조합 부산지부장은 학교 급식실 조리원으로 일하고 있다.  교무행정사인 남수정39 전국학교비정규직노동조합 경북지부 사무처장은 경북 경산시에, 고혜경53 중앙노동위원회 근로자위원은 인천 계양구을에 출마했다.  민중당은 비례대표 1번에도 학교 급식 업무에 종사하는 학교비정규직인 김해정43 송정서초등학교 조리사를 배치했다. 비례대표 1번이어서 민중당이 정당 투표에서 3 이상 득표하면 국회의원에 당선된다.  대학가에서 대표적 비정규직으로 통하는 대학 시간강사 2명은 정의당 소속으로 국회 입성을 노린다.  대학 시간강사 노동조합인 한국비정규교수노동조합 사무처장을 지낸 최만원55 조선대 시간강사가 정의당 공천을 받아 광주 동남구을에 출마했다. 정의당은 나사렛대 시간강사인 박종균54 정의당 장애인위원장도 비례대표 18번에 배치했다.  교사 출신으로 국회의원에 도전하는 인사도 2명 있다.  박상래61 전 한솔고 교장은 무소속으로 세종시갑에 출마했다. 강민정59 서울시교육청 혁신학교운영위원회 위원장도 열린민주당 비례대표 3번 추천을 받아 국회 문을 두드린다.  강 위원장은 중학교 교사 출신으로 전국교직원노동조합 서울북부지회장을 지냈고, 현재 사징검다리교육공동체 상임이사로 활동하고 있다. 곽노현 전 서울시교육감이 이사장으로 있는 단체다.  정의당 공천을 받아 경기 안양시 만안구에 출마한 이종태64 건신대학원대 석좌교수는 한국청소년정책연구원장을 지내는 등 교육과 청소년 분야에서 오랫동안 활동한 교육전문가다.  국민의당 비례대표 4번에 추천받은 김근태씨30도 눈에 띄는 인물 가운데 한 명이다. 서울대 박사과정 수료생인 김씨는 지난해 9월 조국 전 법무부장관 사퇴를 촉구하는 서울대 촛불집회를 이끌어 주목을 받았다.  석호현59 전 한국유치원총연합회한유총 이사장은 미래통합당 공천을 받아 경기 화성시병에 출마한다.  4·15총선에 도전하는 교육계 인사 중 이 11명을 제외한 나머지 27명은 모두 전·현직 대학교수 출신이다.  지역구에 도전하는 대학교수 출신은 미래통합당 소속이 7명으로 가장 많다. 윤희숙50    국제정책대학원 교수가 서울 서초구갑, 15대 통계청장을 지낸 유경준59 한국기술교대 교수가 서울 강남구병에 출마했다.  북한 전문가인 김근식55 경남대 정치외교학과 교수도 미래통합당 공천을 받아 서울 송파구병에 출사표를 던졌다. 경북 경제부지사를 지낸 이인선61 계명대 교수는 대구 수성구을에, 김영식61 전 금오공대 총장은 경북 구미시을에 출마했다. 참여정부 청와대 정책실장과 자유한국당 비상대책위원장을 지낸 김병준66 국민대 명예교수도 미래통합당 간판을 달고 세종시을에서 국회 입성을 노린다. 안기영57 유원대 교양융합학부 교수는 경기 양주시에 출마했다. 하봉규63 부경대 정치외교학과 교수는 우리공화당 공천을 받아 부산 사하구을에 출마했다. 이주천67 전 원광대 사학과 교수도 우리공화당 간판을 달고 부산 사상구에서 국회의원에 도전한다. 더불어민주당은 대통령직속 국가균형발전위원장을 지낸 송재호60 전 제주대 교수를 제주시갑에 공천했다.  차성수63 전 한국교직원공제회 이사장은 민주당의 경선 없는 전략공천에 반발해 서울 금천구에서 무소속으로 출마했다.  비례대표 추천을 받아 국회 입성을 노리는 대학교수 출신도 미래한국당이 6명으로 가장 많다.  윤창현60 서울시립대 경영학부 교수가 2번, 정경희62 영산대 교수가 7번, 조명희65 경북대 항공위성시스템 전공 교수가 미래한국당 비례대표 9번에 배치됐다. 19번 허은아48 경일대 교수와 37번 김경애58 국제대 간호대 교수, 39번 김란숙62 연세대 공학연구원 교수도 미래한국당 비례대표에 이름을 올렸다. 더불어시민당은 권인숙56 명지대 방목기초교육대학 교수가 가장 빠른 3번에 배치됐다. 최혜영41 강동대 교수는 11번, 이상이56 제주대 교수는 24번, 강경숙53 원광대 교수는 25번으로 후보에 등록했다. 국민의당은 5번에 최단비42 원광대 법학전문대학원 조교수를, 10번에 사공정규56 동국대 의대 정신건강의학과 교수를, 11번에 김현아55 전 명지대 방목기초교육대학 조교수를 배치했다.  민생당은 정혜선57 가톨릭대 보건대학원 교수를 비례대표 1번으로 추천했다. 현숙경45 침례신학대 실용영어학과 교수는 기독자유통일당 비례대표 7번에 이름을 올렸다.    1 .  네이버 메인에서 뉴스1 구독하기   4.15총선 관련뉴스   해피펫  © 뉴스1코리아 1. ,"
전공,2020.04.21.,강의 만들어 30개大 공유···국립대 뭉치게 한 '1504억 마중물',"부활하는 국립대⑤  방송대, 4개 국립대와 강의 개발 전북대, 연금공단과 전문가 과정 공공기관·사립대·초중고와 협력  대입지도, 지역봉사 네트워크 활발     방송통신대·한국체대가 공동으로 제작하는 셀프 트레이닝 교과목의 실습장면을 촬영하고 있다. 방송통신대 지난해 4개 국립대학과 함께 5개 온라인 강의를 공동제작했다. 사진 방송통신대               한국방송통신대는 지난해 금오공대·서울교대·서울과학기술대·한국체대 등 4개 국립대의 교수진과 함께 ‘대학수학의 이해’ ‘셀프 트레이닝’ 등 5개 온라인 강의를 제작했다. 공동 개발한 강의는 올 2학기부터 각 대학의 교양과목으로 활용된다.         김옥태 방송대 미디어영상학과 교수는 “48년 원격교육 노하우를 다른 국립대에 공유해 학생에게 질 높은 강의를 제공하려는 시도”라며 “국립대 간의 네트워크를 만들면 국가자원을 효율적으로 활용할 수 있다. 앞으로도 방송대의 온라인강의 플랫폼을 적극적으로 공유하려 한다”고 말했다.         아울러 방송대는 자체 제작한 63개 교양강의를 강릉원주대·한경대 등 6개 국립대 학생들에게 개방하고 있다. 올해 신종 코로나바이러스 감염증코로나19 사태를 맞아 720여개 강의 콘텐트를 전국 국립대 30여곳과 대구·경북 지역 대학에 공개했다.         고등교육의 질을 높이고 지역사회에 기여하기 위해 국립대들이 협업의 대상과 범위를 넓히고 있다. 국립대뿐 아니라 사립대와 함께 네트워크를 만들거나 공공기관, 지역 기업, 초중고와 다양한 협력을 시도하고 있다. 올해 3년 차를 맞은 교육부의 국립대학 육성사업의 성과 중 하나다.        전북의 군산대는 전남의 목포대·순천대, 경남의 창원대와 함께 지난해 9월 ‘공동 진로진학 프로그램’을 진행했다. 지역 국립대끼리 힘을 합쳐 입시 정보 부족으로 어려움을 겪는 수험생을 돕고 지역 인재를 키우자는 취지였다. 최현재 군산대 입학관리본부장은 “단순한 홍보에 그치는 대신 국립대들의 장점을 알리면서 입시정보를 제공하는 프로그램으로 확대하려 한다”고 말했다.          목포해양대는 광주교대ㆍ순천대ㆍ전남대 등 7개 대학과 함께 광주ㆍ전남에서 학업 부진으로 고민하는 대학생의 학습지원을 위한 프로그램을 공동 개발했다. 심층 인터뷰를 통해 학업 부진의 원인을 찾고 지도교수와 교수학습지원센터가 체계적으로 지원한다.             금오공대·경북보건대 등은 지난해 11월 김천지역 저소득 가구를 대상으로 연탄봉사활동을 공동으로 진행했다. 이 지역 7개 대학은 지난해 ‘경북 서부권 대학발전협의회’를 설립해 공동으로 사회공헌활동을 전개하고 있다. 사진 금오공대               사회 공헌을 위한 대학 네트워크 구성도 활발하다. 지난해 금오공대는 경북보건대·구미대 등 6개 대학과 지난해 ‘경북 서부권 대학발전협의회’를 설립했다. 이들 대학은 지난해 11월 구미역 광장에서 주민들을 위한 문화공연을 열었고 연탄배달 봉사, 장애인 지원 활동도 했다. 경남과학기술대는 경남대ㆍ인제대 등 사립대와 함께 ‘사회책임 인력양성 프로그램’을 도입했고 지난해 세 차례 ‘경남 사회적 가치 포럼’도 열었다.        공공기관과의 협력도 활발해졌다. 전북대는 올해 연금관리학 학위과정을 개설했다. 국민연금공단의 전주 이전을 계기 삼았다. 전북대는 경영ㆍ회계ㆍ행정ㆍ사회복지 등 4개 학과를 중심으로 새로운 전공을 개설했고, 공단은 실무자를 강사진으로 보내는 맞춤형 교육에 협력한다.          학교와의 협력도 활발하다. 청주교대 문해력지원센터는 지역 초등학교들과 함께 글을 읽고 이해하는 능력이 부족해 학교 적응에 어려움을 겪는 1ㆍ2학년 학생을 돕고 있다. 지난해부터 문해력 검사를 통해 도움이 필요한 학생을 찾고 매일 30분씩 그림책 읽기 등의 맞춤형 지도를 한다.             목포대가 지난해 10월 섬마을 작은 학교인 신안 안좌고에서 개최한 찾아가는 실험실에서 학생들이 실험장비를 활용해 과학실습을 하고 있다. 사진 목포대               목포대는 지난해 초중고 20곳과 협력해 교육여건이 열악한 섬마을 학생의 과학교육을 돕고 있다. 지난해 10월 신안군 안좌도의 안좌고에선 ‘찾아가는 실험실’ 행사를 진행했다. 학교 방문, 대학 초청 등을 통해 ‘스마트폰을 이용한 물리실험’, ‘ 태양전지 만들기’ 등의 실험 수업을 제공했다. 대구교대는 예비교사들의 인문학 소양 함양을 위해 16개의 독서토론 동아리를 운영했다.        이처럼 교육부의 국립대학 육성사업은 과거 국립·사립 구분 없는 평가 위주의 대학 지원, 구조조정 중심의 국립대 정책으로 인해 침체했던 국립대의 부활에 ‘마중물’이 되고 있다. 교육부의 국립대학 육성사업 규모는 2018년 800억원에서 지난해 1504억원으로 늘었고, 올해도 같은 수준으로 유지된다.          예산이 늘면서 단발성 사업에 치중했던 과거와 달리 장기적인 안목에서 대학 혁신, 지역 상생 프로그램을 추진할 여유를 얻었다고 국립대 관계자들은 밝혔다. 이영석 국립대학육성사업발전협의회장충남대 기획처장은 “전국의 국립대가 지자체와의 협업을 통해 지역 현안을 해결하고, 나아가 국가균형발전을 선도하기 위해선 국립대학 육성사업의 유지·확대가 무엇보다 절실하다”고 말했다.        고석현·천인성 기자 ...      그래서, 팩트가 뭐야 궁금하면 팩플   내 돈 관리는 그게머니    중앙일보 가기 ⓒ중앙일보:..,"
전공,2020.04.28.,경남·동아·영남·한양대 등 산업계 평가 최우수학과 30곳 선정,"대교협 2019년 산업계 관점 대학평가 결과 발표 신소재·미디어·식품 3개 분야서 25개 대학 선정 © 뉴스1 서울뉴스1 권형진 기자  경남대, 동아대, 영남대, 한양대 등 25개 대학 30개 학과가 산업계가 평가한 분야별 최우수 학과에 선정됐다.   한국대학교육협의회대교협는 28일 이 같은 내용의 2019년 산업계 관점 대학평가 결과를 발표했다. 산업계 관점 대학평가는 산업계 수요에 부합하도록 대학 교육과정을 개선하기 위해 2008년 시작됐다. 지난해 평가는 신소재금속·세라믹 미디어, 식품 3개 분야 학과가 설치된 대학 중 참여를 희망한 62개 대학 88개 학과를 대상으로 실시했다.  평가 결과 25개 대학 30개 학과가 최우수에 선정됐다. 신소재금속·세라믹 분야는 금오공대 신소재공학부와 동의대 신소재공학부 등 10곳이, 미디어 분야는 국민대 언론정보학부와 숭실대 언론홍보학과 등 8곳이 선정됐다. 식품 분야에서는 강원대 바이오산업공학부 식품생명공학전공과 숙명여대 식품영양학과 등 12곳이 최우수에 뽑혔다.  경남대는 신소재금속·세라믹와 미디어, 식품 3개 분야 모두에서 최우수 학과에 선정됐다. 동아대와 영남대는 신소재금속·세라믹와 식품, 한양대는 미디어와 식품 2개 분야에서 최우수 학과에 이름을 올렸다.  이번 평가에는 포스코, 두산중공업,  디스플레이, 헬로, 스포츠동아, ㈜풀무원, ㈜농심 등 22개 기업 임직원과 대학평가 전문가가 참여해 산업계 기반 교육과정 설계30와 운영50 성과20 3개 영역에서 점수를 매겼다.   또 대학 교육과정 운영 평가를 위해 참여학과 졸업생과 재학생을 대상으로 설문조사를 실시했다. 직원의 전문·일반직무역량 평가를 위한 설문조사에는 1105개 기업체 부서장이 참여했다.  대교협 관계자는 신산업 분야를 지속적으로 발굴해 산업계 각 분야에서 요구하는 직무역량과 산업트렌드 등에 대한 정보를 대학에 제공하고 현장 적용을 위한 컨설팅을 확대하도록 노력하겠다라고 말했다. 1.  네이버 메인에서 뉴스1 구독하기   뉴스1 바로가기    코로나19 뉴스  © 뉴스1코리아 1. ,"
전공,2020.05.18.,"금오공대, 신소재공학부 신소재분야 최우수학과에 선정","금오공과대학교는 신소재공학부가 2019년 산업계관점 대학평가에서 신소재금속·세라믹분야 최우수학과로 선정됐다고 18일 밝혔다. 한국대학교육협의회가 시행하는 산업계관점 대학평가는 산업계 수요에 부합하는 인력을 양성하기 위한 취지다. 대학 교육과정이 산업계 요구에 일치하는 정도와 교육성과를 평가한다. 올해 평가는 신소재, 미디어, 식품 등 3개 분야 관련 학과가 설치된 대학 가운데 참여를 희망한 62개 대학, 88개 학과를 대상으로 실시됐다. 평가 결과 25개 대학 30개 학과가 최우수로 선정됐다. 금오공대 신소재공학부 연구장면 금오공대 신소재공학부는 미래 첨단소재 산업을 위한 창의적 인재 양성이라는 비전을 바탕으로, 4개 특성화 분야나노구조재료, 에너지기능재료, 정보전자재료, 탄소재료를 전공심화 과정으로 운영하고 있다. 현장실무 관련 교육 프로그램인 창의피움 프로젝트를 수행, 신소재 엔지니어링 페어 등을 통해 산업체 관계자 의견을 지속적으로 수렴한 것이 좋은 평가를 받았다. 박용일 신소재공학부 학부장은 “현장의 목소리를 반영한 환류형 교육 시스템 구축과 구성원들의 노력이 최우수라는 좋은 성과를 가져온 것 같다”면서 “앞으로 산업계와 지속적인 협력을 바탕으로 실무능력을 갖춘 창의적 미래 인재 양성을 위해 노력하겠다”고 말했다. 올해 산업계관점 대학평가는 포스코, 두산중공업,   디스플레이 등 22개 기업 임직원과 대학평가 전문가가 참여해 평가했다. 또 참여 학과 졸업생, 재학생을 비롯, 1100여 개 기업 부서장을 대상으로 한 설문조사 결과도 반영했다. 구미정재훈기자    .  네이버 홈에서 전자신문 구독하기  전자신문 바로가기      ⓒ 전자신문  전자신문인터넷,"
