총동창회,2020.03.25.,"국립 금오공대, 총선 관련 ""정치적 중립 지킨다""","경북 구미 금오공대 전경. 금오공대 제공 경북 구미시 금오공대총장 이상철는 25일 4·15 총선과 관련, 정치적 중립 입장을 밝히는 보도자료를 냈다. 최근 금오공대 총동창회 등이 김영식 미래통합당 구미을 예비후보와 관련, 특정당을 지지했다는 등 오해의 소지가 있다는 지적에 따른 것이다. 김 예비후보는 20132017년 6대 금오공대 총장을 역임했다. 금오공대 측은 자료를 통해 국립대학으로서 정파적 특수이익과 결탁해 공평성을 상실하거나 정쟁에 개입하지 않는 정치적 중립을 지키고 있다고 강조했다. 정인희 금오공대 기획협력처장은 대학 유관단체는 정치적 의견을 공식적으로 밝힌 적이 없으며, 이와 관련한 각종 오해를 미리 방지하고자 한다고 밝혔다. 이창희 기자 888.  네이버에서 매일신문 구독하기  매일신문 네이버 바로가기 ⓒ매일신문  .."
총동창회,2020.04.26.,[인물수첩] 오영환 신임 경북 구미시새마을회장,"오영환 구미시새마을회장 오영환58 신임 경북 구미시새마을회장은 새마을정신을 바탕으로 새마을지도자들이 가진 역량을 모아 지역사회 발전에 도움이 될 수 있도록 열심히 봉사하는 자세로 임하겠다고 소감을 밝혔다. ㈜이엔에이치 대표인 오 회장은 금오공대 재료공학과 박사학위를 받았으며 금오공대 대학원 총동창회 부회장, 매일신문 자문위원 등을 맡고 있다. 모범상공인상과 지식경제부장관상 등을 수상했다. 전병용 기자   126 .  네이버에서 매일신문 구독하기  매일신문 네이버 바로가기 ⓒ매일신문   .."
총동창회,2020.08.12.,상명대·인하대도 '등록금 반환'…교육부지원 발표이후 속속 동참,"교육부, 자구노력한 대학에 한해 지원금 교부 계획 대부분 대학에서 특별장학금 지급 발표하게 될 것 이화여대 학생들이 지난 6월29일 서울 서대문구 이화여대에서 1학기 등록금 반환을 촉구하고 있다.뉴스1 © 1 이승배 기자 서울뉴스1 장지훈 기자  인하대와 상명대가 12일 코로나19 특별장학금 지급 계획을 발표했다. 신종 코로나바이러스 감염증코로나19 여파에 따른 등록금 반환 성격의 장학금을 지급하는 대학들이 속속 늘어나는 분위기다.  특히 교육부가 최근 학생들의 등록금 반환 요구와 관련해 자구노력한 대학에 한해 재정 지원을 하겠다는 발표를 한 이후 대학들의 등록금 반환 움직임이 가속화하는 모양새다.  교육계에 따르면 인하대, 상명대, 남부대, 한국산업기술대, 금오공대, 삼육보건대, 초당대, 광주여대, 인제대 등 전국 각지의 대학이 이날 특별장학금 지급 계획을 발표했다. 전공·계열별로 차이는 있지만 대체로 1학기 재학생이 실제로 납부한 등록금에서 711를 돌려주는 방식이다.  상명대는 대학본부와 학생 대표단의 4차례에 걸친 협의 끝에 지난 10일 개최된 등록금심의위원회에서 1학기 등록금의 7.9에 해당하는 특별장학금을 1학기 재학생 전체에게 지급하기로 결정했다. 성적장학금도 그대로 유지하기로 했다.  인하대도 이날 교직원·총동창회의 모금과 대학 자체의 예산 절감을 통해 마련한 38억5000만원을 들여 올해 1학기 재학생들에게 실제 납부한 등록금의 7.14를 특별장학금으로 지급한다고 밝혔다.  이밖에 다른 대학의 경우 1학기 납부한 등록금에 대해 광주여대는 11, 초당대는 10.8, 삼육보건대·남부대·금오공대·인제대는 10, 한국산업기술대는 8를 각각 돌려주겠다고 발표했다.  앞서 중앙대, 숭실대, 호남대, 공신대, 한신대, 충북대, 경북대, 동의대, 꽃동네대 등 대학도 전날 특별장학금 지급 계획을 공식화한 바 있다.  정부와 대학을 상대로 대학생들이 소송인단을 꾸려 등록금 반환 소송을 진행하고 있을 만큼 등록금 반환 논의에 미온적이었던 대학들이 앞다퉈 특별장학금 지급 계획을 발표하는 상황을 두고 교육계에서는 교육부가 최근 발표한 비대면교육 긴급지원사업 기본계획의 영향이 미쳤다는 분석이 나온다.  교육부는 지난달 30일 3차 추가경정예산추경을 통해 확보한 1000억원의 예산을 재원으로 특별장학금 지급 등 등록금 감면을 위해 실질적인 자구노력을 한 대학을 선정해 오는 10월 중으로 지원금을 교부하겠다고 밝혔다. 지원 대상은 재정지원제한대학을 제외한 자율개선대학 역량강화대학 진단제외 대학 등 가운데 실질적 자구노력을 한 대학으로 전국 대부분의 대학이 포함된다. 다만 적립금을 1000억원 이상 쌓아둔 대학의 경우 지원 대상에서 제외된다.  각 대학은 등록금 반환을 위한 자구노력의 정도에 따라 예산을 지원받아 교육육의 질을 높이기 위한 온라인 강의 질 제고, 코로나19 방역, 교육환경 개선 사업, 실험·실습기자재 구매 등 분야에 사용할 수 있다. 한국대학교육협의회대교협 관계자는 대학들이 장학금 지급 계획을 속속 발표하는 상황이 교육부의 지원사업 계획 발표의 영향을 받은 것은 사실이라며 다만 1학기를 마친 이후 재정 상황을 살펴 결정을 내리기까지 시간이 걸린 부분도 있다고 말했다.  이 관계자는 이어 코로나19로 인해 1학기에 어려움이 있었던 만큼 거의 모든 대학에서 특별장학금 지급 계획을 발표하게 될 것으로 본다고 덧붙였다. 1.  네이버 메인에서 뉴스1 구독하기   뉴스1 바로가기    코로나19 뉴스  © 뉴스1코리아 1. ,"
출신,2020.01.30.,농촌진흥청 새 차장·원장인사 담긴 뜻은?,"머니투데이 세종정혁수 기자   이용범 신임 농촌진흥청 차장, 김두호 국립농업과학원장사진 왼쪽부터 이달 황규석 차장의 갑작스런 퇴임으로 비롯된 농촌진흥청 후임 차장, 소속기관 원장 인사에 관심이 쏠리고 있다.  새로운 라인업을 통해 그동안 스마트농업과 농업연구기관으로서의 경쟁력 제고를 표명한 김경규 청장의 임기 후반기 구상을 가늠할 수 있어서다. 30일 농촌진흥청에 따르면, 김경규 청장의 임기 후반기를 보필할 새 차장에 이용범60 국립농업과학원장이 임명됐다. 또 새 국립농업과학원장에는 김두호59 국립식량과학원장이 자리를 옮겼다.  이번 인사로 공석이 된 국립식량과학원장에는 김상남58 농촌진흥청 농촌지원국장이 유력하게 검토되고 있는 것으로 알려졌다. 황정환 국립원예특작과학원장, 양창범 국립축산과학원장은 올 상반기까지 임기가 남아있다. 황규석 차장은 이날 오후 4시 전북 전주 농진청 국제회의장에서 이임식을 갖고 물러났다. 문재인 정부들어 지능화된 스마트팜 농업기술 개발 등 농업현장의 혁신에 기여했다는 평가를 받고 있다.  ━  공학박사 출신 농업4차산업혁명 청사진 그린다 ━  농진청 안살림은 이제 이용범 차장이 이어가게 됐다. 전직 차장들이 농과대학 출신인데 반해 이 차장은 공대생이다. 금오공대에서 기계설계학을 전공한 뒤 서울대대학원에서 석사농공학과·박사바이오시스템공학과 학위를 취득했다. 농대출신이 많은 농진청에 공대출신으로 뛰어들만큼 농업의 미래에 대한 확신도 뚜렷하다. 농진청 주요 보직인 연구정책국 연구정책과장, 농업공학부장, 연구정책국장 등을 거치며 미래사회 농업의 역할과 변화에 대해 고민했다.  특히 4차산업혁명시대를 맞은 농업현장의 다중 융합형 혁신기술 개발에 주력해 왔다. 기술 중심의 생산과 성장 기반 확충을 통한 농업의 새로운 시장과 일자리 창출에 대한 이해도 높다. 김경규 청장의 신뢰도 돈독하다.  ━ 안정적 관리능력 갖춘 베테랑…소속 연구원장만 두 번째 ━  2018년부터 국립식량과학원을 이끌어 온 김두호 원장이 친정으로 돌아왔다. 김 원장은 연구관시절 국립농업과학원에서 유해생물과장, 화확물질안전과장, 농업생물부장으로 일했다. 농과원 구성원들과 업무에 정통하다는 평가다.  농진청장 비서관과 연구정책과장 등 주요 보직을 역임했다. 온화한 성품에 매너가 좋아 직원상하간  국제신사로 불리운다. 대학에서 농생물학을 전공한 그는 대학원에서 응용곤충학 연구로 석사·박사학위를 받았다.   국립식량과학원장에 이어 국립농업과학원장에 임명되면서 남다른 관운官運도 주목을 받는다. 최근 본격화되고 있는 글로벌 기후변화, 농업생물자원의 고부가 신소재 이용기술 개발, 곤충산업 육성, 농업 에너지 절감기술 개발 등 베테랑으로서 풀어내야 할 과제도 많다.  ━ 대변인 출신, 지도직서 첫 소속 연구원장 나올까  ━  국립식량과학원장으로 검토되고 있는 김상남 농진청 농촌지원국장은 지도직 출신이다. 인사검증을 무난하게 통과한다면 연구직이 대물림해 온 소속 연구원 수장을 맡는 첫 지도직 인사가 된다. 농진청 대변인 출신으로 주요 농정현안에 대한 이해가 밝고 적극적인 업무능력과 대인관계가 뛰어나다. 농촌지원국장으로 재직하면서 일선 현장에서 필요로 하는 농업기술 개발과 이를 보급하는 데 주력해 왔다. 또 농촌자원과 재해대응은 물론 식량산업기술팀을 이끌며 주요 현안과제를 다루어 온 만큼 국립식량과학원장으로 손색이 없다는 얘기가 나온다. 농촌진흥청 한 연구관은 김 국장의 국립식량과학원장 발탁 가능성을 두고 농진청 안팎에서는 전례가 없는 파격으로 보는 시각이 많다며 지도직, 연구직간 보이지 않는 벽을 허물고 과감한 혁신을 주문한 김경규 청장의 의지로 풀이된다고 말했다.  세종정혁수 기자   . 세계 1,2위 부자는 잠을 얼마나 잘까 장모 명의로 바뀐 집, 이혼하면…   네이버 구독하기   저작권자 ⓒ 돈이 보이는 리얼타임 뉴스 머니투데이,"
출신,2020.01.29.,농촌진흥청 차장에 이용범 국립농업과학원장,"세종뉴시스이용범 신임 농촌진흥청 차장. 사진  농진청 제공 세종뉴시스 장서우 기자  제28대 농촌진흥청 차장에 이용범58 국립농업과학원장이 임명됐다. 농진청은 29일 이 원장이 승진 기용됐다고 밝혔다. 경남 함안군 출신인 이 신임 차장은 금오공과대학교 기계설계학과를 졸업했다. 서울대학교에서 농공학과 석사 학위를, 바이오시스템공학과 공학박사 학위를 취득했다. 1990년 농진청 내 농업기계화연구소에서 연구직 임용과 함께 공직 생활을 시작했다. 농진청 농업공학연구소 기초기술공학과장, 국립농업과학원 생산자동화기계과장, 연구정책국 실용화기술과장·연구정책과장, 재해예방공학과장, 농업과학부장 등을 연이어 지낸 후 2016년 연구정책국장에 올랐다.  2017년에는 농진청 4차 산업혁명 대응단장을 맡아 스마트 농업 관련 직무를 도맡았다. 2018년부터 올해 1월까지 원장으로서 농과원을 이끌어 왔다. 한편 농과원장 자리에는 김두호 국립식량과학원장57이 기용됐다. ☞공감언론 뉴시스     .   오픈 미술작품 가격을 공개합니다  뉴시스 빅데이터  주가시세표 바로가기"
출신,2020.01.30.,농진청 신임 차장에 이용범 국립농업과학원장,"농촌진흥청은 제28대 농촌진흥청 차장에 이용범〈사진〉 국립농업과학원장을 29일자로 임명했다. 이용범 신임 농진청 차장은 경남 함안 출신으로 금오공대 기계설계학과를 졸업하고 서울대 바이오시스템공학과에서 공학박사를 받았다. 지난 1990년 농진청 농업공학연구소 연구직으로 공직을 시작해 농과원 생산자동화기계과장, 연구정책국 연구정책과장·연구정책국장을 역임했다. 황해창 기자 네이버에서 헤럴드경제 채널 구독하기 제49회 헤럴드 전국 영어 말하기대회   헤럴드경제 사이트 바로가기       ⓒ 헤럴드경제   . ,"
출신,2020.01.29.,농진청 차장에 이용범 국립농업과학원장 임명,"서울경제 농촌진흥청은 29일 제28대 농촌진흥청 차장에 이용범58·사진국립농업과학원장을 임명했다. 이 신임 차장은 경남 함안 출신으로 금오공대 기계설계학과를 졸업하고 서울대 바이오시스템공학과에서 공학박사를 받았다. 지난 1990년 농진청 농업공학연구소 연구직으로 공직을 시작, 농과원 생산자동화기계과장, 연구정책국 연구정책과장·연구정책국장을 역임했다. 또 농진청 4차 산업혁명대응단 단장을 맡아 스마트농업의 기초를 다졌으며 이후 2018년부터 국립농업과학원을 이끌어 왔다. 서울경제 바로가기  한 눈에 쏙 새로워진 서울경제 모바일 페이지를 만나보세요.   네이버 채널에서 서울경제 채널 구독해주세요  저작권자 ⓒ 서울경제,"
출신,2020.02.03.,[새얼굴]장봉식 태백산국립공원사무소장,"장봉식55 태백산국립공원사무소장은 “민족의 영산 태백산의 자연·문화적인 가치를 보호하고 지역사회와의 상생을 통해 주민과 함께하는 태백산국립공원을 만들겠다”고 피력. 경북 문경 출신. 문경공고, 금오공대 토목공학과를 졸업. 공원시설처, 운문산관리단장, 지질공원사무국장 등을 역임.  ⓒ 강원일보,"
