취업,2020.04.02.,"""코로나19 함께 극복해요""…금오공대 '심리상담 콜센터' 운영","금오공과대학교 사진뉴시스     구미뉴시스 박홍식 기자  금오공과대학교는 대학 구성원을 위한 금오 심리상담 콜센터를 운영한다고 2일 밝혔다. 신종 코로나바이러스 감염증코로나19 장기화에 따라 구성원들의 심리적 불안을 해소하고 정신건강을 돕기 위해서다. 심리상담은 전화05447879368, 홈페이지 게시판, 화상상담전화상담 후 시행 등 다양한 채널로 진행된다. 오는 6월까지 평일 오전 9시부터 오후 6시까지 이용 가능하다.  금오공대는 심리상담 콜센터 이외에도 재학생을 대상으로 한 건강 설문조사를 실시해 고위험군 및 상담희망자를 선별 관리할 계획이다.  또한 건강 관련 정보 제공과 정부산하 무료상담기관 안내를 통해 구성원들이 코로나19 관련 불안감을 예방할 수 있도록 노력하고 있다. 한편, 등교일 지연으로 1:1 대면하던 교수와 학생 상담을 비대면으로 변경한다.  진로, 취업, 학업, 대인관계 등의 내용으로 매학기 2회 이상 진행된 상담은 전화, 온라인 등을 활용해 시행한다.  금오공대는 코로나19를 극복하고 함께 상생하자는 의미에서 성금모금, 지역 경제 살리기, 헌혈 캠페인 등도 시행하고 있다.  대구·경북에 거주하는 구성원이 다수를 차지하는 만큼 내부 모금이 아니라 자발적, 자율적으로 상생 캠페인에 동참하도록 대학 홈페이지를 통해 ‘상생 캠페인’을 펼치고 있다. 이상철 금오공대 총장은 고통 분담, 극복도 모두 함께 할 때 해낼 수 있다는 것을 잊지 말고 슬기롭게 이 위기를 이겨낼 수 있기를 바란다고 말했다. ☞공감언론 뉴시스    6431 .  선택 2020, 제21대 총선의 모든 것  , 유명 미술작품 가격 공개  뉴시스 빅데이터  주가시세표 바로가기  ⓒ 공감언론 뉴시스통신사. 무단전재재배포 금지"
취업,2020.04.12.,[취업걱정없는 명품학교]<226>대중금속공업고등학교,"대중금속공업고등학교는 1978년 국영기업 대한중석에서 국내 최초 금속 분야 특수목적 고등학교를 목표로 설립한 명문 특성화고다. 40여년이 넘는 기간 동안 졸업생 8130명을 배출, 대한민국 현장 곳곳에서 산업발전의 중추적인 기술인재로 활동하고 있다. 특히, 대한민국 명장 5명이 대중금속공업고를 졸업했다. 대중금속공업고등학교 전경. 대중금속공업고는 학년별로 체계화된 취업연계 교육 프로그램을 갖췄다. 1학년은 기계계열로 입학해 1년간 정밀기계과, 자동화기계과, 금형기계과를 순환하며 교육실습을 받는다. 2학년은 전공학과를 선택하게 된다. 1년간 전공학과 순환 수업, 실습 경험을 바탕으로 학생의 소질과 적성에 맞는 전공학과를 선택할 수 있다. 그 결과 학업 능률 향상과 자격증 취득률, 취업률 제고 등에서 성과를 내며 학생과 학부모에게 좋은 반응을 얻고 있다. 또 4차 산업혁명에 능동적으로 대응할 수 있는 인성과 기술을 두루 갖춘 융합형 인재를 만드는 맞춤형 교육과정 덕분에 지역사회 신망이 두터운 학교로 자리 잡았다. 대증금속공업고는 학생 취업 역량 강화를 위해 중소기업 특성화고 인력양성사업, 산학일체형 도제학교, 과정평가형 자격과정, 대구광역시 맞춤형 인력양성사업 등을 운영 중이다. 중소벤처기업부와 교육부 지원으로 기업과 학교가 취업확정 협약을 맺고 현장 맞춤형 교육 후 취업까지 연결하고 있다. 산학일체형 도제학교이하 도제반는 1학년 때 기계계열 공통과정을 마친 후, 2학년 학과 선택 시 누구나 도제반을 지원할 수 있다. 합격자는 2, 3학년에 산업현장에서 경험을 쌓아 졸업과 동시에 기업체 취업으로 연결한다. 이밖에도 과정평가형 자격과정, 지역구 맞춤형 인력양성사업 등 다양한 취업 관련 프로그램을 운영하고 있다. 사제동행 풋살동아리 대중아트싸커. 학교 특색사업으로 선취업·후진학 진로프로그램 322 시스템을 구축 운영한다. 졸업과 동시에 산업체에 먼저 취업해 직장생활을 하면서 2년 과정인 사이버대학 또는 일학습병행, 야간대학 과정에서 2년간 수학하면 대구대와 금오공대 34학년 과정인 계약학과로 진학해 학위를 취득하는 과정이다. 대구지역 특성화고 중 유일하게 전국단위모집 학교로 최신식 기숙사를 운영하는 것도 자랑거리다. 특히 공무원, 공기업, 대기업, 기숙사 취업특별반 등을 구성해 기술 영재의 꿈 터로 운영한다. 요일별 독서활동, 체육활동, 분기별 기숙사 체육대회 등 단체생활 속에서 선후배가 사랑과 협력으로 배우고 실천하는 문화를 조성하고 있다. 최근에는 직업계고 재구조화 사업을 추진하고 있다. 학령인구 감소, 노동 시장의 급변 등 주변 환경 변화를 고려해 중장기 발전계획과 연계한 학과 개편과 내실화를 꾀하고 있다. 4차 산업혁명 및 서비스 중심 사회로 변화하는 직업사회에 능동적으로 대응하기 위해 미래로 가는 특성화고를 준비 중이다. 김병부 대중금속공업고 교장은 “취업 준비 능력, 업무 수행 능력이 향상된 우수 전문 기능인을 양성하겠다”면서 “우수 졸업생 배출로 지역 사회와 경제 발전에 기여하는 학교가 되도록 교직원 모두가 화합하겠다”고 밝혔다. 조정형기자    .  네이버 홈에서 전자신문 구독하기  전자신문 바로가기      ⓒ 전자신문  전자신문인터넷,"
취업,2020.04.23.,"금오공대, 신입생 위한 온라인 특강·세미나 시행","세미나 강의 사진금오공대 제공 구미뉴시스 박홍식 기자  금오공과대학교는 2020학년도 신입생을 대상으로 다양한 비교과 프로그램을 진행하고 있다고 23일 밝혔다. 대학혁신지원사업 등에서 지원하는 비교과 프로그램은 실시간 및   를 활용한 온라인 강의로 꾸몄다. 지난 20일부터 시작해 27일까지 진행 예정인 ‘      세미나’는 창의적인 사고와 도전정신을 함양시키는 비대면 실습 교육이다.  지식에 의존하지 않고 상상력을 통해 문제를 해결하는 강의로 상담심리교육 전문기관을 통해 시행하고 있다.  교육에 참여하는 신입생들이 각자의 창의적 활동 과정을 사진 또는 영상으로 보여 주며 서로의 아이디어를 공유하고 토론할 수 있도록 소규모 분반 형태로 실시간 진행된다.  공학인으로서 기술의 발전에 대해 이해할 수 있는 특강도 열렸다.  지난 14일부터 19일까지 진행된 4차 산업혁명 연계 특강은 ‘공학도의 미래’라는 주제로 미래사회 기술이 가져올 변화와 공대생이 길러야 할 역량에 대해 다뤘다.  김나연 학생이 강의를 듣고 있다 사진금오공대 제공 오는 28일에는 ‘공대생의 의사소통읽기, 쓰기, 말하기’을 주제로 한 특강이 준비돼 있다.  이외에도 신입생들이 적성 및 역량을 스스로 파악할 수 있는 ‘   온라인 자가 진단’을 실시해 진로 탐색의 기회를 제공했으며, 성폭력 및 가정폭력 예방 온라인 교육도 시행할 계획이다.  특강에 참여한 학생들은 당장 눈앞에 보이는 취업이나 스펙에 매달리지 말고 세상의 변화를 잘 바라보며 미래를 준비하는 인재가 돼야겠다는 생각이 들었다고 말했다. 이어 캠퍼스에서 새로 만나게 될 친구들과 함께 듣지 못한 아쉬움은 있지만 진지하게 미래에 대해 생각해 볼 수 있는 강의를 접하게 돼 유익했다고 했다.  금오공대는 24학년으로 구성된 62명의 재학생들을 신입생 멘토로 선발해 신입생 조기 적응에 도움을 주고 있다.  멘토들은 상담자로서의 원활한 역할 수행을 위해 소통과 리더십 관련 사전 교육을 이수했으며, 앞으로도 신입생 상담 관련 역량 강화 교육을 지속적으로 받게 된다. ☞공감언론 뉴시스    6431 .  네이버에서 뉴시스 구독하기  , 유명 미술작품 가격 공개  뉴시스 빅데이터  주가시세표 바로가기  ⓒ 공감언론 뉴시스통신사. 무단전재재배포 금지"
취업,2020.04.24.,금오공대 '온라인 산업체 채용 합동설명회' 열어,"구미뉴시스 박홍식 기자  금오공과대학교는 지역 선도대학 육성사업 온라인 산업체 채용 합동 설명회를 연다고 24일 밝혔다. 신종 코로나바이러스 감염증코로나19 확산으로 위축된 취업·채용 시장 활성화를 위해서다. 오는 27일부터 시작되는 온라인 산업체 채용 합동 설명회에는 도레이첨단소재, 구일엔지니어링, 세아메카닉스 등 지역 20여곳 산업체가 참여한다.  금오공대가 선도하고 안동대, 경북대상주, 동양대가 함께한다. 지역선도대학 육성사업의 4개 대학 학생을 비롯해 지역민 누구나 참여할 수 있도록 오픈 공개 시스템으로 진행한다. 금오공대는 기업별 회사 소개, 채용 관련 사항 설명, 질의응답 등을 촬영해 강의지원 시스템에 탑재했다. 타 대학 재학생 및 일반인도    아이디가 있으면 누구나 접속할 수 있도록 했다.  설명회에 앞서 사전 조사한 학생들의 취업 관련 질의 사항을 기업에 제공해 실질적인 질의응답이 가능하도록 했다. 정인희 금오공대 기획협력처장은 학생들은 지역 기업에 대한 최신 정보와 취업 노하우를 습득해 취업 경쟁력을 강화하고 기업은 우수한 지역 인재 채용의 장을 마련한다는 취지에서 설명회를 개최하게 됐다고 말했다. 이어 다양한 비대면 채용 설명회를 통해 현장 리쿠르팅의 공백을 최소화할 수 있도록 노력하겠다고 했다.   한편 금오공대는 코로나19 장기화에 따라 안정적인 교육·학습권 보장을 위해 2020학년도 1학기 전기간 전과목 비대면 수업을 하고 있다. 채용 설명회를 비롯한 다양한 비교과 활동을 온라인으로 시행하고 있다. ☞공감언론 뉴시스    6431 .  네이버에서 뉴시스 구독하기  , 유명 미술작품 가격 공개  뉴시스 빅데이터  주가시세표 바로가기  ⓒ 공감언론 뉴시스통신사. 무단전재재배포 금지"
취업,2020.04.24.,"금오공대, 신입생 위한 온라인 특강·세미나 전개","머니투데이 대학경제 임홍조 기자   금오공과대학교는 올해 신입생을 대상으로 다양한 비교과 프로그램을 실시하고 있다고 24일 밝혔다.  대학혁신지원사업 등에서 지원하는 비교과 프로그램은 실시간 혹은   를 활용한 온라인 강의로 진행된다.   특히 오는 27일까지 진행 예정인       세미나는 창의적인 사고와 도전정신을 함양하는 비대면 실습 교육이다. 지식에 의존하지 않고 상상력을 통해 문제를 해결하는 강의로, 상담심리교육 전문기관을 통해 진행 중이다. 이 교육에 참여하는 신입생들은 각자의 창의적 활동 과정을 사진이나 영상으로 보여준다. 수업은 서로의 아이디어를 공유, 토론할 수 있도록 소규모 분반 형태로 실시간 이뤄진다. 또한 공학인으로서 기술의 발전에 대해 이해할 수 있는 특강도 열렸다. 지난 1419일 진행된 4차 산업혁명 연계 특강은 공학도의 미래라는 주제로 미래사회 기술이 가져올 변화와 공대생이 길러야 할 역량에 대해 다뤘다. 오는 28일에는 공대생의 의사소통읽기, 쓰기, 말하기이라는 주제의 특강도 준비됐다.  이외에도 신입생들이 적성, 역량을 스스로 파악할 수 있도록    온라인 자가 진단을 실시해 진로 탐색의 기회를 제공했으며, 성폭력과 가정폭력 예방 온라인 교육도 전개할 계획이다.  김근태 전자공학부 학생은 이번 교육을 통해 취업이나 스펙보다는 세상의 흐름을 읽고 미래를 준비하는 자세의 필요성을 배웠다며 캠퍼스에서 새로 만날 친구와 함께 듣지 못해 아쉽지만, 진지하게 미래를 생각할 있는 시간이라 유익했다고 말했다.    한편 금오공대는 24학년들로 구성된 62명의 재학생들을 신입생 멘토로 선발해 신입생의 대학생활 적응을 돕고 있다. 멘토들은 상담자로서 원활한 역할 수행을 위해 소통과 리더십 관련 사전 교육을 이수했으며, 앞으로도 신입생 상담 관련 역량 강화 교육을 지속적으로 받는다.  임홍조 기자  줄리아 투자노트 조 변호사의 가정상담소   머니투데이 구독하기   저작권자 ⓒ 돈이 보이는 리얼타임 뉴스 머니투데이,"
취업,2020.06.23.,구미전자공고 '경북 기능경기대회' 종합 2위,"최근 5년 평균 취업률 97.1 달성…전국 최고 구미전자공고가 2020학년도 경북 지방기능경기대회에서 상을 휩쓸면서, 경북 종합순위 2위를 차지했다. 구미전자공고 제공 경북 구미전자공고교장 이준우가 2020학년도 경상북도 지방기능경기대회에서 상을 휩쓸면서 개교이래 최고의 성적을 거뒀다. 구미전자공고는 이번 대회 7개 직종에 출전해 금5·은5·동3·우수3를 획득해 경상북도 종합순위 2위를 차지했다. 입상 선수들은 9월 전북에서 열리는 제55회 전국기능경기대회에 경북 대표로 출전한다. 구미전자공고는 기능뿐만 아니라 취업에 있어서도 최근 5년 평균 취업률 97.1를 달성해 전국 최고를 자랑하고 있다. 특히 올 1월 졸업생들은 대기업삼성,   , 포스코, 현대,    등에 99명37.4, 공기업한국전력, 한전  , 한국수력원자력, 한국수자원공사 등 44명15.8 중견기업 33명12.5, 중소기업 78명29.4 취업했다. 구미전자공고는 산업계 수요를 반영해 전자·전기·기계 등 전공 분야별로 인재를 양성해왔다. 또 기술·산업 환경이 급변함에 따라 이를 반영한 특화교육과정으로 서울대, 카이스트, 금오공대와 연계해 지능형반도체반을 방과후 수업을 운영하고 있다. 이러한 결과 지난해 마이스터고 5년간 운영 성과 평가에서 우수학교로 지정됐다. 교육부 관계자는 학교 경영뿐만 아니라 학교 관련자 만족도 조사, 교육프로그램 운영, 취업률, 취업의 질 등을 종합적으로 평가한 결과 구미전자공고가 모든 항목에서 매우 우수해 마이스터고의 표준이 된다고 평가했다. 전병용 기자   126 .  네이버에서 매일신문 구독하기  매일신문 네이버 바로가기 ⓒ매일신문   .."
취업,2020.07.07.,"통합당 미래산업특위 첫 회의..ICT 융합, 인재 양성 등 논의","韓, 4차산업혁명 적응력 순위 주요 45개국 중 25위에 그쳐 文 정부의 세금으로 만든 공공일자리 양산은 한계 있어 역동적 산업구조, 장기적 국가전략으로 ‘좋은 일자리’ 창출해야 이데일리 김현아 기자 미래통합당 조명희 의원이 오늘7일오후 국회 본관에서 「미래산업일자리특별위원회위원장 조명희」 첫 회의를 주재하고, “기존의 공공 부문 일자리 양산이 아닌 미래 고부가가치산업 육성을 통한 일자리 창출 전략이 필요하다”고 강조했다.  미래통합당 비대위는 지난 2일, 포스트코로나 시대 전개될 사회적 변화와 이슈를 선도하기 위해 과학기술·위성정보 전문가인 조명희 의원을 위원장으로 하는 「미래산업일자리특위」를 출범한 바 있다. 금일 개최된 회의에서는 김종인 비대위원장이 참석한 가운데 조명희 위원장과 16인의 위원에게 임명장을 수여하고, 전통산업과    융합    신기술 및 데이터 활용 스타트업과 기업육성 융합형 인재양성 방안 등 향후 특위가 중점적으로 추진할 정책 아젠다에 대해 논의하는 전체회의를 열었다. 김종인 비대위원장은 “4차산업 시대에는 고도의 전문성을 갖춘 일자리가 필요할 것이라 생각하기에 그런 일자리를 확보할 수 있는 방법을 찾기 위해 특위가 노력해줬으면 좋겠다”고 강조하며 “미래 산업에도 우리가 이전처럼 많은 일자리는 아니더라도 새로운 일자리를 창출할 수 있는 가능성이 충분하다”고 발언했다.  韓, 4차산업혁명 적응력 순위 주요 45개국 중 25위에 그쳐 조명희 위원장은 모두발언에서 “문재인 정부의 재정만능주의에 기반한 공공일자리 양산정책으로는 최악으로 치닫고 있는 경제 침체와 취업난을 해결할 수 없다”며, “우리나라 경제 체질을 ‘추격형’에서 ‘선도형’으로 바꾸고, 신산업이 성장할 수 있는 역동적 환경이 마련해야만 새로운 일자리 창출도 가능 할 것”이라고 말했다.  이어 “우리나라는 미래산업정책을 포괄적으로 추진하고, 기존 규제의 틀에서 벗어나지 못하는 부분이 많아 4차산업 적응력 순위가 주요 45개국 중 25위 스위스               조사 에 그칠 정도로 속도가 더디다”고 비판하며, “정부 주도의 성장모델이 한계에 직면하고 기초체력이 약화된 한국 경제의 근본적인 구조개혁을 위해서는 장기적인 국가 미래 전략이 필요하다”고 강조했다. 그는 “교육자이자 과학자, 벤처기업   로 지내며 체감한 경험을 바탕으로 과학기술, 교육, 산업, 노동 분야별로 어떠한 구조개혁이 필요한지 실질적인 미래전략을 수립해 나가겠다”고 각오를 다졌다. 미래일자리특위는 김영식 의원경북 구미시을, 이주환 의원부산 연제구, 김성태 전 의원비례, 송희경 전 의원, 김화동 전 한국조폐공사 사장, 박용후 파와이에이치 대표, 최재붕 성균관대 기계공학부 교수,          박봉규 이사장, 법무법인 린 테크앤로부문 구태언 부문장, 배현민 카이스트 교수, 박병종 콜버스랩 대표, 손동섭 한국로봇융합연구원 기획조정실장, 한동석 경북대  · 자동차융합연구센터장, 김동성 금오공대 산학협력단장, 송재승 세종대 교수, 박승정 지디넷 코리아 편집국장 등 4차산업혁명을 주도하고 있는 산·학·연 전문가로 위원을 구성한 바 있다. 김현아    ..  네이버에서 ‘이데일리’ 구독하기 청춘뉘우스 스냅타임 ＜ⓒ종합 경제정보 미디어 이데일리  무단전재  재배포 금지＞"
취업,2020.07.13.,"""2010년부턴 저금리 전환 안 돼요""…학자금대출 부담","동영상 뉴스 앵커 과거에 비싼 이자 내고 학자금 대출을 받았던 사람들이 저금리로 갈아탈 수 있는 제도가 있습니다. 그런데 그 대상자가 한정돼 있어서 혜택을 받지 못하는 청년들이 많습니다. 송인호 기자가 그들의 목소리를 들어봤습니다. 기자 2008년 대학교 2학년 때부터 15년 만기 학자금 대출을 받은 30대 청년입니다. 최근 코로나 여파로 직장을 잃어 다달이 내는 학자금 대출 상환 부담이 더 커졌습니다. 장학재단 일반상환 학자금 대출자 : 실직한 상태이고, 당장 길이 막막하다 보니까. 금리 자체가 앞으로 똑같은 금리로 적용된다고 하면 많은 부담이 될 것 같습니다. 2008년 7.8 금리로 처음 받은 학자금 대출은 2014년 2.9 금리로 갈아탈 수 있었지만, 문제는 2010년 대출분부터입니다. 2년간 6차례 고정금리 대출을 추가로 받았는데, 금리가 4.9에서 5.7로 현재 1.85와 비교하면 최대 3배가 넘습니다. 장학재단은 기존 고금리 학자금 대출을 저금리로 바꿔주고 있지만, 변동금리 상품이 도입된 2010년 이후 대출자는 전환 대상에서 제외했습니다. 한국장학재단 관계자 : 아무래도 재원은 한정되어 있다 보니까. 그 당시 저소득층이던 친구들은 변동금리로 취업 후 상환 학자금으로 대출을 실행할 수 있었고…. 2010년에서 2012년 사이 상대적 고금리 학자금 대출을 받은 청년은 117만여 명. 이 가운데 13만여 명이 여전히 높은 이자를 내며 대출금을 갚고 있습니다. 장학재단 일반상환 학자금 대출자 : 금리 인하 요구권을 요구할 수도 없고, 10년 전 금리로 앞으로 5년을 더 고정금리로 갚아야 하는데…. 김영식국회 교육위 의원 전 금오공대 총장 : 젊은 청년들이 굉장히 어려움을 겪고 있습니다. 대출금액이 약 4천7백억 원 정도 되니, 전환 대출해주면 170억 원 정도 학생들에게 혜택을 줄 수 있다고 보고 있습니다. 코로나 여파가 장기화할 것이라는 전망이 나오는 가운데, 청년 부담 경감을 위한 교육당국의 추가 대책이 필요해 보입니다. 영상취재 : 김현상, 영상편집 : 황지영,    : 오세관 송인호 기자   ..   더 깊은 인물 이야기 그, 사람  마부작침 민식이법이 놓친 것들 ※ ⓒ      . : 무단복제 및 재배포 금지"
취업,2020.08.12.,"경북 구미 금오공대, 'AI 빅데이터센터' 개소식","데이터 분석 기반의 교육 혁신 프로세스 구축 금오공대 관계자들이  빅데이터센터 개소식을 하고 기념촬영을 하고 있다. 금오공대 제공 금오공대총장 이상철는 12일 교내 도서관 든사람교육센터에서 미래형 공학교육 실현을 위한  빅데이터센터 개소식을 했다. 이날 개소식에 이어 최호섭 단국대 교수를 초청,  빅데이터 기반의 교육 혁신 추진을 위한 특강이 있었다. 이 센터는 입학·진로·취업·교육·연구·산학협력 등 대학에서 생성되는 다양한 데이터에 대한 수집 및 분석 업무를 수행한다. 김태형  빅데이터센터장은 축적되는 다양한 데이터를 기반으로 대학과 지역 혁신의 발판이 마련되길 기대한다. 구미지역의 스마트 산단, 강소연구개발특구 사업 등과 연계해 4차 산업혁명의 기술 허브로 성장할 수 있도록 노력하겠다고 밝혔다. 이창희 기자 888.  네이버에서 매일신문 구독하기  매일신문 네이버 바로가기 ⓒ매일신문  .."
