2017.08.10.,국립대 총장 공석사태 새 정부도 ‘감감’,"전국 국립대 4곳 가운데 1곳에서 총장이 없는 상황이 이어지고 있다. 10일이면 새 정부가 출범한 지 석 달이 되지만 해법은 여전히 요원한 상태다. 시급한 해결책을 요구하는 목소리가 높아지고 있는 가운데 최근엔 국립대 총장 직선제 부활 움직임도 일고 있다. 9일 각 대학에 따르면 전체 38곳의 국립대 중에서 9곳에서 현재 총장이 없는 상태로 학교 행정이 운영되고 있다. 총장이 없는 대학은 공주대를 비롯해 전주교대, 광주교대, 금오공과대, 목포해양대, 부산교대, 춘천교대, 한경대, 한국방송통신대 등 9곳에 이른다. 이들 대학은 대부분 박근혜정부가 1·2순위 총장 임용 후보자에 대한 임명 제청을 거부하면서 길게는 3년 반 가까이 총장 자리가 공석이다. 이 같은 상황에 일각에선 ‘교육계에도 블랙리스트가 존재하는 것 아니냐’는 의혹마저 나온다. 공주대는 2014년 3월부터 41개월째, 전주교대는 2015년 2월 이후 30개월째 직무대리 체재로 운영 중이다. 이에 공주대 교수회와 총학생회는 최근 기자회견을 열고 “대학을 파행으로 몰아간 건 박근혜정부의 대표적 교육적폐 때문”이라며 “민주적 절차에 따라 선정된 1순위 후보를 총장에 즉각 임명하라”고 요구했다. 공주대와 방송통신대, 전주교대의 총장 1순위 후보자들은 교육부가 특별한 사유 없이 제청을 거부했다는 이유로 소송을 제기해 대법원 판결을 앞두고 있다. 총장 공석 사태가 계속되면서 각 대학 측은 각종 사업 추진이나 학사 행정에 큰 어려움을 겪고 있는 것으로 알려졌다. ‘학령인구 감소’로 인해 조만간 닥칠 위기에 대다수 대학이 대응책 마련에 부산하지만 이들 대학은 사실상 손을 놓고 있는 실정이다. 특히 이들 대학 중 4곳의 교육대학은 최근 교사임용 문제까지 불거져 불안감이 더욱 커지고 있다. 9개 대학들은 문재인정부 출범에 큰 기대를 걸었으나 공석 사태가 이어지자 불만을 쏟아내고 있다. 특히 김상곤 교육부장관은 “장관이 되면 해결하겠다”고 청문회 당시 공언했지만 취임한지 5주가 넘었음에도 뚜렷한 해결책을 내놓지 못해 타깃이 되고 있다. 대학들은 “총장이 선임되지 않아 중장기 발전 계획을 세우지 못하고 학내 혼란만 계속돼 학교 구성원들의 피해가 커지고 있다”고 목소리를 높였다. 손수진 공주대 교수회장은 “학교 수장이 없는 것은 배에 선장이 없는 것과 같다”며 “새 정부 들어 희망을 가졌으나 아직도 해결이 되지 않아 답답하다. 시급히 해법을 찾아 달라“고 말했다. 전주김용권 기자   홈페이지 페이스북 취재대행소 왱클릭 ⓒ . , "
2017.08.09.,도내 교장·교사 30여명에 ‘국외 문화재 바로알기’ 연수,"한국국외문화재연구원 직무연수 구미 정창구 기자  사한국국외문화재연구원원장 박영석은 지난달 31일부터 이달 4일까지 금오공대평생교육원에서 도내 일선학교 교장·교사 등 30여 명이 참여한 가운데 ‘국외 경북문화재 바로알기’라는 주제로 교사 직무연수 프로그램을 운영했다. 이번 연수기간 동안 최선일 문화재청 감정위원과 임남수 영남대 교수, 신두환 안동대 교수 등 각계 전문가들이 일제강점기 우리문화재 약탈 현황, 문화재 환수 관련 국제법·사례, 19세기 한·중 문인들의 교류와 기증사례 등에 대한 특강에 나섰다. 한국국외문화재연구원은 이번 교직원 연수 프로그램에서 나타난 뜨거운 반응에 따라 내년부터 대구·경북지역 교사와 일반 시민들을 대상으로 프로그램을 확대해 나갈 방침이다. 박영석 한국국외문화재연구원 원장은 “국외문화재 환수와 현지의 활용을 높이기 위해 국외문화재에 대한 일반 국민들의 관심과 이해를 높이는 것이 필수적이다”며 “일선 학교 교사와 일반 시민들을 대상으로 교육을 확대해 나가겠다”고 했다.  "
2017.08.11.,"금오공대 창업동아리, 22년째 초등생 발명·창업캠프","11일 경북 구미시 봉곡초등학교에서 열리고 있는 ‘2017 발명창업 캠프’에 참여한 어린이들이 진지한 표정으로 조단위 활동을 하고 있다금오공대제공2017.8.11 © 1 정우용 기자  정우용 기자 금오공대의 한 창업동아리가 22년째 초등학생을 위한 발명·창업 캠프를 열고 있다. 11일 금오공대에 따르면 창업동아리 거북선신화 학생들이 지난 9일부터 구미지역 초등학생을 대상으로 발명창업 캠프를 개최하고 있다. 구미 봉곡초교에서 진행되는 이 캠프는 동아리 학생들이 재능기부로 참여해 11일까지 봉곡초교, 금오초교 학생들의 맞춤형 멘토 역할을 하며 아이디어 마케팅, 풍력 자동차 만들기, 시청각 교육 등으로 발명·창업 체험을 돕는다. 1994년부터 초등생 발명·창업 캠프를 열고 있는 거북선신화는 지난해 말레이시아 국제발명·혁신·기술전시회에서 은상과 특별상, 세계발명혁신대전에서 은상을 수상한 바 있다. 정연구 금오공대 사업단 창업교육센터장은 발명창업캠프를 통해 초등학생들이 발명과 창업의 꿈나무로 자라길 바란다고 말했다. 11일 경북 구미시 봉곡초등학교에서 열리고 있는 ‘2017 발명창업 캠프’에 참여한 어린이들이 진지한 표정으로 조단위 활동을 하고 있다금오공대제공2017.8.11 © 1 정우용 기자 1 . 놓치면 후회 최신 만화 보기 2017년 나의 운세 보기 생생한 영상뉴스, 눈 여러분의 제보를 기다립니다. 클릭 ©  ,"
2017.08.11.,"금오공대, '발명&창업캠프' 개최"," 대학경제 심현영 기자 금오공과대학교 사회맞춤형 산학협력선도대학 육성사업단이하 사업단, 단장 김학성이 지역 초등학생을 대상으로 2017 발명창업 캠프를 개최했다. 이번 캠프는 금오공대 사업단 창업교육센터가 주관하고, 금오공대 학생처와 창의지식재산센터 지원으로 개최됐다. 금오공대 창업동아리인 거북선신화 학생들을 중심으로 지난 9일부터 11일까지 경북 구미 봉곡초등학교에서 열렸다. 이번 캠프는 초등학생봉곡초·금오초들에게 진로체험과 창의성 개발, 발명·창업문화를 알려주고, 지역사회 공헌과 더불어 초·중·고 창업교육 활성화를 목적으로 마련됐다. 창업 관련 외부 전문가 창업특강을 비롯해 대학생들이 맞춤형 멘토가 돼 아이디어 마케팅, 풍력 자동차 만들기, 시청각 교육 등 발명·창업을 체험하는 과정으로 진행됐다. 금오공대 창업동아리 거북선신화는 초등학생 대상 발명 및 창업 캠프를 지난 1994년부터 22년째 이어오고 있다. 또한 2016 말레이시아 국제발명, 혁신, 기술전시회에서 은상과 특별상, 세계발명혁신대전 은상을 수상했다. 정연구 금오공대 사업단 창업교육센터장은 이번 발명창업캠프를 통해 지역 초등학생들이 발명과 창업 꿈나무로 자라길 바란다며 앞으로도 지역사회와 초·중·고 창업교육 활성화를 위해 노력하겠다고 밝혔다. 칼럼깊이있는 투자정보 스타일트렌드리더 스타일 지침서 빵빵한 차레이싱걸 심현영 기자 "
2017.08.13.,"금오공대, 구미 초등생 '발명&창업 캠프' 열어","박홍식 기자 금오공과대학교 사회맞춤형 산학협력선도대학 육성사업단이하 사업단, 단장 김학성은 경북 구미지역 초등학생을 대상으로 ‘2017 발명창업 캠프를 열었다고 13일 밝혔다.사진은 지난 12일 봉곡초등학교에서 열린 수업 장면. 2017.08.13 사진금오공대 제공  . 박홍식 기자 금오공과대학교 사회맞춤형 산학협력선도대학 육성사업단이하 사업단, 단장 김학성은 경북 구미지역 초등학생을 대상으로 ‘2017 발명창업 캠프를 열었다고 13일 밝혔다. 이번 캠프는 금오공대 사업단의 창업교육센터가 주관하고, 금오공대 학생처와 창의지식재산센터가 지원했다. 금오공대 창업동아리인 거북선신화 학생들을 중심으로 지난 912일까지 구미 봉곡초등학교에서 열렸다. 이 캠프는 초등학생봉곡초․금오초들에게 진로체험과 창의성 개발, 발명·창업 문화를 알려주는 계기가 됐다는 점에서 큰 의미를 두고 있다. 지역사회 공헌과 함께 초·중·고 창업교육 활성화를 목적으로 마련됐다. 창업 관련 외부 전문가의 창업특강을 비롯해 대학생창업 동아리들이 맞춤형 멘토가 돼 아이디어 마케팅, 풍력 자동차 만들기, 시청각 교육 등 발명·창업을 체험하는 과정으로 진행됐다. 금오공대 창업동아리 거북선신화지도교수 최성대는 초등학생 대상의 발명 및 창업 캠프를 1994년부터 22년째 매년 이어오고 있다. 지난해 말레이시아 국제발명·혁신·기술전시회에서 은상과 특별상, 세계발명혁신대전 은상을 수상하는 등 각종 국내·외 경진대회에서 수상 경력을 자랑한다. 정연구 금오공대 사업단 창업교육센터장은 이번 발명창업캠프를 통해 지역의 초등학생들이 발명과 창업 꿈나무로 자라길 바란다며 앞으로도 지역사회와 초중고 창업교육 활성화를 위해 더욱 노력하겠다고 말했다.  . , 네이버 뉴스 스탠드에서도 만나세요 뉴시스 페이스북 트위터 . ."
2017.08.14.,4년제 국공립대 입학금 폐지한다…사립대도 인하 나설 듯(종합),"군산대 첫 폐지 이후 2주일만…교육부, 사립대 입학금 내역 조사  고유선 기자 전국 4년제 국공립대가 내년부터 입학금을 전면 폐지할 것으로 보인다. 14일 교육계에 따르면 국공립대총장협의회는 17일 회의를 열고 입학금 폐지 방안을 확정할 계획이다. 국공립대총장협의회는 전국 50여개 4년제 국공립대 가운데 41개 학교 총장들이 구성한 협의체다. 경북대·부산대·충북대·전남대 등 지역 주요 국립대거점국립대 10곳, 군산대·금오공대·부경대를 비롯한 지역 중소 국립대 19곳, 교육대학교 10곳 등 고등교육법을 바탕으로 설립된 국공립대가 참여하고 있다. 이 가운데 19개 중소 대학이 참여하는 지역중심 국공립대총장협의회는 이미 이달 초 입학금 폐지와 전형료 인하 계획을 밝힌 바 있다. 한 국립대 관계자는 재정 상황이 좋은 것은 아니지만 학생·학부모 부담을 줄이기 위해 입학금을 없애야 한다는 필요성에 대해 공감대가 형성됐다며 17일회의에서 발표 방식에 대한 논의가 있을 것이라고 전했다. 4년제 국립대 가운데 대구경북과학기술원 등 고등교육법이 아닌 다른 법령에 따라 만들어진 대학은 협의회에 속해 있지 않아 자체적으로 입학금 조정 여부를 결정할 것으로 보인다. 교육부에 따르면 2017학년도 국립대 1인당 평균 입학금은 14만9천500원이다. 2015회계연도의 국립대 세입 자료를 살펴보면 입학금 수입111억원 비중은 0.3에 불과하다. 지난달 전북 군산대가 처음으로 입학금 폐지를 결정한 지 불과 2주일여 만에 전국 국공립대가 입학금을 없애기로 한 것도 이처럼 재정에서 입학금이 차지하는 비율이 낮기 때문으로 분석된다. 교육계에서는 이제 사립대에 눈길이 쏠릴 것으로 예상하고 있다. 2017학년도 전국 사립대의 1인당 평균 입학금은 77만3천500원으로 국립대의 5배가 넘는다. 가장 비싼 곳은 한국외대로 99만8천원이었다. 이 때문에 학생·학부모가 입학금 부담이 줄었다는 점을 체감하려면 사립대가 입학금 폐지에 동참해야 한다는 지적이 나온다. 다만, 사립대의 경우 전면 폐지보다는 대학들이 자체적으로 태스크포스를 꾸린 뒤 수년에 걸쳐 단계적으로 인하하는 방안을 내놓을 것으로 보인다. 교육부는 다음 달 사립대들이 입학금을 얼마나 걷어 어디에 쓰는지를 표본 또는 전수조사할 계획이다. 대학은 입학금과 수업료를 모두 등록금 회계로 처리하기 때문에 입학금이 정확히 어디에 쓰이는지 용처를 알기 어렵다는 지적이 제기돼왔다. 교육부 관계자는 용처는 큰 차이가 없을 텐데 사립대 입학금이 많게는 국립대의 10배에 달하는 점은 입학금 징수의 정당성에 의문을 갖게 한다며 적정 수준 이상의 입학금은 단계적으로 폐지하는 것이 맞다고 말했다.  최신 유행 트렌드 총집결클릭"
2017.08.14.,4년제 국공립대 입학금 폐지할 듯…사립대도 인하 움직임,"전국 4년제 국공립대가 내년부터 입학금을 전면 폐지할 것으로 보인다. 14일 교육계에 따르면 국공립대총장협의회는 17일 회의를 열고 입학금 폐지 방안을 확정할 계획이다. 국공립대총장협의회는 전국 50여개 4년제 국공립대 가운데 41개 학교 총장들이 구성한 협의체다. 경북대·부산대·충북대·전남대 등 지역 주요 국립대거점국립대 10곳, 군산대·금오공대·부경대를 비롯한 지역 중소 국립대 19곳, 교육대학교 10곳 등 고등교육법을 바탕으로 설립된 국공립대가 참여하고 있다. 이 가운데 19개 중소 대학이 참여하는 지역중심 국공립대총장협의회는 이미 이달 초 입학금 폐지와 전형료 인하 계획을 밝힌 바 있다. 교육부에 따르면 2017학년도 국립대 1인당 평균 입학금은 14만9500원이다. 교육계에서는 이제 사립대에 눈길이 쏠릴 것으로 예상하고 있다. 2017학년도 전국 사립대의 1인당 평균 입학금은 77만3500원으로 국립대의 5배가 넘는다. 가장 비싼 곳은 한국외대로 99만8000원이었다. 이 때문에 학생·학부모가 입학금 부담이 줄었다는 점을 체감하려면 사립대가 입학금 폐지에 동참해야 한다는 지적이 나온다. 디지털뉴스국  공식 페이스북 오늘의 인기뉴스 매경 프리미엄 ⓒ   ,"
2017.08.16.,구미아시아연극제 9월4~16일까지 각 공연장에서," 경북 구미시가 주최하는 아시아연극제가 9월 4일부터 16일까지 금오공대를 비롯한 시내 각 공연장에서 진행된다. 이번 연극제의 공식 작품은 한국과 일본, 칠레팀의 6개 작품이 금오공대 강당과 소극장에서 나눠 공연된다. 금오공대에서는 9월 8일 한국의 타이타스를 시작으로 12일 칠레의 가 무대에 오른다. 또 소극장 ‘공터다’에서는 9일과 10일, 13일에 각각 일본의 , 헬로우 고스트, 안스케극장이 공연되며 14일에는 한국의 쿵쾅쿵쾅 고물놀이터가 열연한다. 또 기획행사로는 시민예술가전과 찾아가는 공연이 준비돼 있다. 또 연계행사로 제18회 영호남연극제가 4일간 4개 작품이 공연되고, 구미시 일대를 찾아가는 작은 극장 운영으로 시민들의 참여도를 높일 예정이다. 이현종기자 13 .   1997년 이래 대한민국 최고의 과학자  의 모든 연재물. 서경   ⓒ ,"
2017.08.16.,"경북대, 2018학년도부터 입학금 전면폐지?","대구 이규현 기자 경북대 등 전국 4년제 국·공립대가 내년부터 입학금을 전면 폐지할 것으로 보인다. 경북대는 16일 현재 구체적인 입학금 폐지 여부는 결정하지 못했으나 17일 국·공립대총장협의회에서 확정하는데로 따르기로 했다고 밝혔다. 국·공립대총장협의회는 전국 4년제 국공립대 50여 곳 가운데 41개 학교 총장들로 구성된 협의체로, 이미 입학금 폐지 방침을 결정한 것으로 알려졌다. 경북대는 대입 전형료 인하에 이어 입학금 마져 폐지된다면 학교 재정에 큰 어려움이 예상된다며 우려를 표명하고 있다. 경북대의 2017학년도 입학금은 16만6,500원이다. 이보다 앞서 금오공대와 안동대 등는 이달 초 입학금 폐지 계획을 밝힌 바 있다. 교육부는 입학금 비중이 적은 국,공립대부터 입학금을 없애고, 사립대의 동참을 유도할 방침인 것으로 알려졌다. .  ©  ."
2017.08.15.,文정부 ‘대학 학비부담 낮추기’ 속도 낸다… ‘사립대 입학금’ 분석,"대학생과 학부모에 가해지는 학비 부담을 낮추려는 정부 정책이 속도를 내고 있다. 정부는 다음 달까지 사립대들이 입학금을 어떻게 산정하며 어디에 쓰는지 들여다보기로 했다. 교육부는 입학금 인하 여부와 정부 재정지원을 연계할 뜻을 내비치고 있어 상당한 압박으로 작용할 전망이다. 전국 4년제 국공립대 41곳은 조만간 입학금 폐지 방침을 발표할 예정인 것으로 알려졌다. 교육부 관계자는 14일 “사립대로부터 입학금 산정 내역과 지출 내역을 받아볼 계획”이라며 “전수조사를 할지 일부 대학만 추려 표본조사로 진행할지 검토 중”이라고 밝혔다. 입학금이란 신입생이 입학할 때 등록금 외 별도로 납부하는 돈이다. 산출 근거와 용도가 불확실해 불필요한 부담이란 지적이 적지 않았다. 입학금 수입은 관행적으로 수업료 수입에 합쳐 학교 운영비 등에 사용된 것으로 알려졌다. 이를 교육부가 정밀하게 분석해 불필요한 부분은 줄이도록 유도한다는 것이다. 실제 지난달 중순 교육부가 전국 대학에 입학 전형료 인하 계획을 제출하라고 요구하자 대학들이 입학 전형료 인하 계획을 앞 다퉈 발표했었다. 입학 전형료는 대학이 입시를 치르며 드는 비용 등을 이유로 지원자로부터 걷는 돈이다. 전형료 장사란 비판이 많았다. 사립대 입학금은 천차만별이다. 올해 기준 입학금 1위는 한국외국어대로 99만8000원이다. 홍익대 99만6000원, 고려대 99만5400원, 인하대 99만2000원 순이다. 반면 영산선학대는 입학금이 15만원이고, 광주가톨릭대의 경우 입학금을 전혀 받지 않는다. 사립대들은 정부가 국고보조금 지원을 지렛대 삼아 입학금 인하 혹은 폐지를 유도할 것으로 내다보고 있다. 국립대는 입학금을 없앨 것으로 알려졌다. 교육부 등에 따르면 국공립대총장협의회는 오는 17일 회의에서 입학금 폐지 방안을 확정할 계획이다. 국공립대총장협의회는 전국 50여개 4년제 국공립대 중 41개 학교 총장들로 구성된 협의체다. 경북대 부산대 등 거점국립대 10곳, 군산대 금오공대 부경대 등 지역 중소 국립대 19곳, 교육대 10곳 등이 참여하고 있다. 19개 중소 국립대들이 포함된 지역중심 국공립대총장협의회는 이달 초 입학금 폐지와 전형료 인하 계획을 밝혔다. 교육부는 ‘무늬만 반값’이란 비판을 받았던 반값등록금 정책도 손볼 계획이다. 교육부 관계자는 “반값등록금은 막대한 재정이 투입되지만 대학생이나 학부모 만족도는 낮았다. 대학생이 실제로 학비 부담이 낮아졌다 느낄 수 있도록 새 반값등록금 체계를 마련할 것”이라고 말했다. 글이도경 기자  , 그래픽박동민 기자  홈페이지 페이스북 취재대행소 왱클릭 ⓒ . , "
2017.08.15.,"4년제 국·공립대, 입학금 전면 폐지할 듯","국공립대총장協 17일 확정 발표…사립대는 단계적 인하로 갈 듯 전창훈 기자  경북대를 비롯한 전국 4년제 국공립대가 내년부터 입학금을 전면 폐지할 전망이다. 국공립대총장협의회는 17일 회의를 갖고 입학금 폐지 계획을 확정할 예정이다. 국공립대총장협의회는 전국 4년제 국공립대 50여 곳 가운데 41개 학교 총장들로 구성된 협의체다. 금오공대와 안동대 등 전국 19개 지역 중심 국립대는 이미 이달 초에 입학금 폐지 계획을 밝힌 바 있다. 교육부에 따르면 올해 국립대와 사립대의 1인당 평균 입학금은 각각 14만9천500원, 77만3천500원이다. 교육부는 수입 중 입학금 비중이 적은 국공립대부터 입학금을 없애고, 사립대의 동참을 유도할 방침이다. 하지만 사립대들은 국공립대와 상황이 다른 만큼 전면 폐지는 사실상 어렵다는 반응을 보였다. 대구권 한 사립대 관계자는 국공립대는 입학금이 많지 않고 정부 지원을 받을 수 있지만 사립대는 입장이 다르다며 반값 등록금이 되면서 교직원 급여가 수년째 동결된 만큼 주요 수입원 가운데 하나인 입학금까지 없애기는 불가능하다고 말했다. 이 때문에 사립대 입학금은 전면 폐지보다 단계적 인하 쪽으로 방향을 잡을 것이라는 것이 대학가의 예상이다.  "
2017.08.15.,내년 4년제 국공립대 입학금 폐지,"서울신문 전국 41개 국공립대들이 내년 신입생부터 입학금을 받지 않는다. 이에 따라 문재인 대통령의 대선공약 중 하나인 대학 입학금 폐지가 사립대로 확산될지 주목된다. 윤여표 국공립대총장협의회장은 14일 “오는 17일 협의회 회의를 열고 입학금 폐지 방안을 확정할 계획”이라면서 “협의체에 속한 41개 대학 모두 참여하기로 했다”고 말했다. 국공립대총장협의회는 전국 50여개 4년제 국공립대 가운데 41개 학교 총장들이 구성한 협의체다. 부산대·충북대 등 지역 주요 국립대거점국립대 10곳, 군산대·금오공대 등 지역 중소 국립대 19곳, 교육대 10곳 등이 속해 있다. 한 국립대 관계자는 “재정 상황이 좋지는 않지만 학생과 학부모의 부담을 줄이기 위해 입학금을 없애야 한다는 데 공감대가 형성됐다”고 말했다. 교육부에 따르면 2017학년도 국립대 신입생 1명당 평균 입학금은 14만 9500원이다. 국립대 세입 중 입학금 수입111억원 비중은 0.32015회계연도 기준에 불과하다. 지난달 전북 군산대가 처음 입학금 폐지를 결정한 지 2주일여 만에 전국 국공립대가 입학금을 없애기로 뜻을 모은 것도 재정에서 입학금이 차지하는 비율이 낮기 때문으로 분석된다. 이제 사립대가 입학금 폐지 대열에 동참할지 눈길이 쏠린다. 2017학년도 전국 사립대의 1인당 평균 입학금은 77만 3500원으로 국립대의 5배가 넘는다. 다만 사립대들은 전면 폐지보다 대학들이 자체적으로 태스크포스를 꾸린 뒤 수년에 걸쳐 단계적으로 인하하는 방안을 내놓을 가능성이 높다. 유대근 기자  재미있는 세상 나우뉴스 인기 무료만화 페이스북 ⓒ 서울신문 . , "
