2017.03.08.,'학생 수는 줄고'…대구·경북 국립대 생존 위한 연대 잇따라,"학점교류에 교육과정 공동 개발…경북대·대구교대 등 협업 체계 구축 경북대  제공 대구· 이강일 기자 대구·경북에 국립대끼리 경쟁력 강화와 생존을 위한 연대가 이어지고 있다. 그동안 국립대는 싼 교육비, 우수한 교육 여건 등으로 학생 선호도가 사립대에 앞섰다. 하지만 학생 수 감소 등에 따른 영향은 국립대도 피하지 못할 것으로 보이자 자구책 마련에 나선 것이다. 경북대는 지난달 21일 대구교대와 학점교류 등 협업 체계를 구축했다. 대구·경북에서 국립대 사이 첫 협업이다. 두 대학은 교원 양성기능을 연계하고 학점·교직원 교류, 공동 교육과정 개발·연구, 공간·시설물 공동 활용 등을 골자로 하는 양해각서를 체결했다. 앞으로 실무협의체를 구성해 석·박사과정 공동 운영 등 구체적인 협력 범위를 결정한다. 또 정부가 재정을 지원하는 사업에 공동 대응하는 등 협력 범위를 점차 확대하기로 했다. 경북대 관계자는 인근 지역뿐만 아니라 다른 지역 국·사립대와 협업 시스템을 구축하는 데도 힘을 쏟을 계획이다고 말했다. 경북대·대구교대에 이어 안동대와 금오공대도 지난달 28일 협력적 거버넌스 구축을 위한 협약을 했다. 안동대·금오공대도 인적교수·학생·직원교류, 학점교류, 공동교육과정공동학위 운영, 시설 교류 등에 협력한다. 대학별 강점 분야를 중심으로 컨소시엄을 구성해 해외 대학과 자매결연 등도 추진할 계획이다. 또 전략적 협력체계 구축의 하나로 두 대학 기획처장을 공동위원장으로 하는 사업추진 공동협의체도 만들어 운영한다. 앞서 2008년 경북대는 대구·경북 국립대 경쟁력 제고 등을 내세워 상주대현 경북대 상주캠퍼스와 통합했다. 2009년에는 노동일 당시 경북대 총장이 대학 특성을 살릴 수 있도록 특성화와 차별화에 중점을 두고 경북대와 안동대 통합을 추진하겠다고 밝히기도 했다. 경북대와 안동대 통합 노력은 그 뒤 별 진전이 없다. 한 대학 관계자는 교육부가 각종 재정지원 사업을 할 때 대학 간 교류·협력을 중요시하기 때문에 앞으로도 국·공·사립을 가리지 않고 서로 협업에 나설 것으로 보인다고 말했다.  대박난 흥부가 즐겨찾는 흥클릭"
2017.03.08.,중국 1위 캠핑용품회사가 반한 '대구산 탄소섬유 온열매트',"주목 이기업 지유엠아이씨 홍콩 요양병원 등에 올 2380만달러어치 수출 오경묵 기자 탄소섬유 발열소재를 활용해 전기온열매트와 발열장갑, 자동차시트 히터를 개발하고 있는 스타트업신생 벤처기업이 제품을 출시하기도 전에 수출에 잇따라 성공하고 있다. 2014년 1인 기업으로 창업한 지유엠아이씨대표 신석균·사진는 지난달 18일 중국 베이징 국제 스포츠용품 및 패션박람회에서 중국 캠핑용품 1위 업체인 저장모디가든캠핑용품유한공사와 침낭, 발열매트 등을 공동 개발하기로 하는 양해각서를 맺었다고 8일 발표했다. 향후 제품 수출액은 400만달러 상당이다. 이 회사는 지난해 8월 홍콩 바이어와 2380만달러 규모의 요양병원용 온열매트 납품계약을 맺었고 제품 수출은 올해부터 할 계획이다. 지난해 6월 국방부 우수상용품에 선정된 발열장갑도 조만간 공급이 기대되는 전략 상품이다. 신석균 대표는 “기존 제품들이 섬유에 탄소가루를 코팅하는 방식인 데 비해 개발제품은 탄소 소재의 실로 만들었다”며 “이 소재로 제조한 온열제품은 선이 끊어질 염려가 없을 뿐만 아니라 제품 두께가 얇고 소비전력도 적다”고 말했다. 탄소섬유 발열소재는 온열기기뿐만 아니라 웨어러블기기, 아웃도어와 스포츠용품 등 다양한 분야에 적합해 국내외 기업과 바이어로부터 관심이 부쩍 많아졌다. 지난해 탄소섬유 발열선을 이용한 화물트럭용 24온열매트 등 4건의 특허를 출원했다. 대학에서 법학을 전공한 신 대표는 2012년부터 탄소섬유 발열체에 대한 연구를 시작했다. 금오공대와 구미전자정보기술원, 한국섬유기계연구원, 구미국방벤처센터 등과 협력해 기술을 발전시켰다. 신 대표는 “창업 후 5억원을 투자하는 동안 한푼의 매출도 올리지 못했지만 대기업의 요구사항을 맞추는 과정에서 독보적인 기술력을 확보했다”며 “올해 150억200억원의 매출이 가능하다”고 말했다. 이 회사는 완성차 1차 협력업체와 자동차 시트히터를 연구개발하고 있다. 히터를 사용하기 어려운 환경에 있는 근로자를 위한 발열조끼와 캠핑용 발열침낭, 발열텐트 등 아웃도어와 스포츠 분야로 개발대상을 확대하고 있다. 대구오경묵 기자 .  스내커   . ,"
2017.03.09.,[빅데이터 인사이트] 사드 배치와 `금한령`… 예측불가 한반도,"이연경 연세대 커뮤니케이션연구소 전문연구위원 이연경 연세대 커뮤니케이션연구소 전문연구위원 황교안 대통령 권한대행 국무총리가 특검 연장을 거부하면서 특검 수사는 종결됐고, 차기 대선 주자들의 움직임도 바빠졌다. 사드 배치로 인한 한중 간 외교 갈등이 심해지면서 중국인들의 한국 관광은 전면금지 조치가 내려졌으며, 일각에서는 북한의 테러 위협과 사드 배치 진행을 둘러싼 갑론을박 논쟁이 진행되기도 했다. 지난 2주간2017.2.262017.3.6 어떤 사건들이 우리 사회의 주요 쟁점거리였는지 네이버 뉴스토픽 키워드총 140개를 구체적으로 분석해 본다. 지난 분석 기간에 이어, 이번에도 문화연예 분야의 뉴스들이 대중들의 관심을 가장 집중시켰다. 문화연예 분야의 키워드는 43.6를 차지해, 전체 140개 중 61개가 포함됐다. 프로그램과 출연진들에 대한 뉴스, 연예인들의 사건사고 뉴스 등이 주로 이어졌으며 마마무 흑인 비하 논란은 이틀 연속 뉴스토픽 상위 키워드에 랭크되기도 했다. 걸그룹 마마무가 그들의 단독콘서트에서 해외 유명 팝가수를 패러디하던 과정에서 불거진 흑인 비하 논란에 휩싸인 가운데, 네티즌들의 질타가 이어졌다. 두 번째로는 정치 분야에 대한 비중이 높았다. 전체 중 24.334개가 포함됐다. 최근 2주 간은 특검 연장 여부를 두고 벌어진 논쟁들과 사드 배치에 관한 입장 차이와 사드 배치로 인해 야기된 한중 간 외교 갈등이 주요 쟁점 거리였다. 먼저, 황교안 대통령 권한대행 국무총리가 박영수 특검팀 수사기간 연장을 거부하자, 야당에서는 황교안 국무총리 탄핵론을 제기하고 나섰다. 특검 연장 최종 불허 결정이 난 2월 27일에는 황교안 탄핵 키워드가 일간 종합 뉴스토픽 랭킹 1위를 기록했고, 국민의당 박지원 대표가 특검 연장 불허 결정을 한 황교안 대통령 권한대행에 대해 역사의 죄인으로 기록될 것이라고 비판하면서 역사의 죄인으로 기록될 것이라는 키워드 역시 2위에 랭크됐다. 특검 연장 거부 키워드도 10위에 랭크되면서일간 전체 키워드 10개 중 3개가 관련 키워드로 기록됐다. 사드 배치와 관련된 뉴스토픽 키워드는 정치 분야의 키워드 34개 중에서 3개로, 정치분야 내 9의 비중을 차지했다. 사드 부지 교환계약 체결, 사드 배치 차질없이 추진, 그리고 중국인들의 한국 관광 전면금지가 관련 키워드로 포함됐다. 중국인들의 한국관광 전면 금지는 국내 여행업계 및 면세점, 화장품 업계 등에는 직격탄이 되고 있으며 한국 문화 콘텐츠에 대한 금한령禁韓令·한류 금지령도 이어지고 있어 외교부의 대응에 귀추가 주목된다. 사회 분야의 키워드는 전체 중 13.619개로 세 번째로 높은 비중을 차지했다. 아시아나항공 홈페이지 해킹, 금오공대 버스사고 등의 사건 사고가 포함됐으며, 내수 경제를 활성화하기 위한 목적으로 정부가 내세운 금요일 4시 퇴근 도입안에 대해서는 정책의 실효성을 두고 의견들이 엇갈렸다. 한편, 구직 포기 청년의 규모가 3년 5개월 만에 처음으로 증가세로 반전하며, 41개월만에 증가세를 보였다. 최근 몇 년 간 이어지고 있는 사상 최악의 청년실업률과 청년들의 구직포기까지 이어지면서 씁쓸함을 자아내고 있다. 국제사회의 다양한 사건사고와 함께 지난주부터 이어진 김정남 암살 사건으로, 국제정치 분야의 뉴스도 10.7 비중을 차지했다. 그 외 스포츠 분야에서 5, 경제 분야에서 2.9의 키워드가 포함됐다. 우리 사회 다방면에 해결되지 못한 문제, 해결해야만 하는 문제들이 가득 차 있다. 이미 국론은 분열된 지 오래고, 갈등은 걷잡을 수 없이 심화됐다. 더 이상의 사회적 충돌과 비용 소모는 없어야 할 것이다. 이제는 매듭이 지어져야 한다. 디지털타임스 홈페이지   확바뀐 디지털타임스 연예·스포츠 섹션  ⓒ 디지털타임스  ,"
2017.03.11.,금오공대 '창조경제혁신센터 협업 우수기관' 선정,"박홍식 기자 경북 구미 금오공과대학교가 창조경제혁신센터 협업 우수기관에 선정됐다. 11일 금오공대에 따르면, 창조경제 확산을 통해 지역 산업 발전에 기여한 공로로 창조경제혁신센터 협업 우수기관에 뽑혀 미래창조과학부 장관상을 수상했다. 금오공대는 2015년부터 경북창조경제혁신센터와 공동으로 경북 지역 대학생과 일반인을 대상으로 기업 애로 기술 발굴에 힘써 왔다. 대학은 또 창의적 문제 해결을 위한 신新 가치 창출 아이디어 경진대회를 통해 창조경제 실현에 기여했다. 발명·창업 아이디어 경진대회를 비롯해 청소년 창업교육, 초중고 자유학기제 등을 공동 개최하며 창조경제 실현과 창업 생태계 구축을 위한 다양한 활동을 펼쳤다. 김영식 금오공대 총장은 대학이 보유한 우수한 기술과 인적 자원을 기업과 공유함으로써 발전된 협업 모델을 구축할 수 있었다며 상호 협력 체계를 강화해 지역 산업과 국가경제 발전에 기여하도록 노력하겠다고 말했다. 한편, 금오공대는 지난해 3월 경북창조경제혁신센터와 협약을 체결하고 양 기관의 인적·물적 자원 공유, 교류를 위한 협력을 지속했다.  . , 네이버 뉴스 스탠드에서도 만나세요 뉴시스 페이스북 트위터 . ."
2017.03.10.,"금오공대, K-RC교육 통해 전인교육 실현"," 대학경제 권현수 기자 금오공과대학교는 2017학년도 신입생 전원을 대상으로 기숙대학 프로그램을 시행한다고 10일 밝혔다. 올해 2년째 시행되는 금오공대 교육은 교과와 비교과로 나눠 진행되는 융합형 인재양성 프로그램이다. 교육은 생활관 입사를 원칙으로, 신입생의 공동체 의식과 소속감을 고취하고 자기주도 활동을 통해 창의적 역량을 갖춘 인재를 양성하는데 목적이 있다. 올해 교육 프로그램에는 2017학년도 신입생 1267명이 참여한다. 교육 교과 프로그램은 종합적인 인성 함양을 위해 생활의 이해라는 교양 과정을 이수한다. 이 과정은 해당 분야 전문가 초청 특강 수업 후 에세이 작성 및 독서 인증제 참여 형태로 진행된다. 비교과 프로그램은 방과 후 프로그램으로, 분반 모임 및 활동을 통해 사회봉사, 제작, 외국어 학습, 합창, 창업, 체육활동 등 다양한 체험활동에 참여한다. 지난해 이 프로그램에 참여한 이지유전자 융합전공 2학년학생은 프로그램이 대학 생활에 길잡이가 됐다며 올해 신입생들도 다양한 활동을 통해 자신이 꿈꾸는 미래 청사진을 그리길 바란다고 말했다. 박제철 금오공대 교육원장은 금오공대 교육 프로그램은 학생 중심의 교과, 비교과 프로그램 운영으로 전인교육의 초석을 제공하기 위한 것이라며, 공동체 교육을 통해 신입생에게 대학 문화를 공유하고, 창의교육의 모델이 되길 기대한다고 밝혔다. 깊이있는 투자정보 칼럼 트렌드 리더의 스타일 지침서 스타일 빵빵한 차레이싱걸 권현수 기자 "
2017.03.10.,"금오공대, 신입생 전원 대상 기숙대학 프로그램 운영","금오공과대학교총장 김영식가 2017학년도 신입생 전원을 대상으로 기숙대학 프로그램 : 을 시행한다. 교육은 생활관 입사를 원칙으로, 신입생의 공동체 의식과 소속감을 고취시키고 자기주도 활동을 통해 창의적 역량을 갖춘 인재를 양성하는데 목적이 있다. 올해 교육 프로그램에는 2017학년도 신입생 1267명이 참여한다. 교육의 교과 프로그램은 종합적인 인성 함양을 위해 생활의 이해라는 교양 과정을 이수한다. 이 과정은 해당 분야 내·외부 전문가 초청 특강 수업 후 에세이 작성 및 독서 인증제 참여 형태로 진행된다. 박제철 금오공대 교육원장은 “금오공대 교육 프로그램은 학생 중심의 교과, 비교과 프로그램 운영으로 전인교육의 초석을 제공하기 위한 것”이라면서 “공동체 교육을 통해 신입생들에게 대학 문화를 공유하고, 창의교육의 모델이 되길 기대한다”고 밝혔다. 구미정재훈기자 . 전자신문 인기 포스트 전자신문 공식 페이스북 전자신문  ⓒ 전자신문 전자신문인터넷,"
2017.03.10.,"창조혁신센터 협업 우수기관, 금오공과대 미래부 장관상","구미 이창희 기자   금오공과대학교총장 김영식가 9일 창조경제혁신센터 협업 우수 기관에 선정, 미래창조과학부 장관상을 받았다. 금오공대는 2015년부터 경북창조경제혁신센터와 함께 경북도 내 대학생 및 일반인을 대상으로 기업애로 기술을 발굴하고, 신가치창출 아이디어 경진대회를 여는 등 창조경제 실현으로 지역산업 발전에 기여한 공로를 인정받았다. 특히 대학생들의 발명창업 아이디어 경진대회를 비롯해 사업계획서 경진대회, 청소년 창업교육, 초중고 자유학기제 등으로 창조경제 실현 및 창업 생태계 구축에 다양한 활동을 펼쳤다. 김영식 총장은 “대학이 보유한 우수한 기술과 인적 자원을 기업, 지역사회와 공유함으로써 발전된 협업 모델을 구축할 수 있었다”고 말했다.  "
2017.03.12.,금오공대 ' K-RC 기숙대학 프로그램' 운영,"박홍식 기자 경북 구미 금오공과대학교총장 김영식가 2017학년도 신입생 전원을 대상으로 기숙대학 프로그램을 시행한다. 12일 대학에 따르면 금오공대 교육은 교과와 비교과로 나눠 진행하는 융합형 인재양성 프로그램이다. 교육은 생활관 입사를 원칙으로 신입생의 공동체 의식과 소속감을 고취시키고 자기주도의 활동을 통해 창의적 역량을 갖춘 인재를 양성하는데 목적이 있다. 올해 2년째 시행하는 교육 프로그램은 오는 13일부터 2017학년도 신입생 1267명이 참여한 가운데 열린다. 교육의 교과 프로그램은 종합적인 인성 함양을 위해 생활의 이해라는 교양 과정을 이수하도록 한다. 이 과정은 해당 분야의 내·외부 전문가 초청 특강 수업 후 에세이 작성 및 독서 인증제 참여 형태로 진행된다. 비교과 프로그램은 방과 후 프로그램으로 분반 모임과 활동을 통해 사회봉사, 제작, 외국어 학습, 합창, 창업, 체육활동 등 다양한 체험활동에 참여하게 된다. 지난해 이 프로그램에 참여한 이지유전자 융합전공·2년씨는 프로그램이 대학 생활의 길잡이가 돼 주었다며 올해 신입생들도 다양한 활동을 통해 자신이 꿈꾸는 미래 청사진을 그리기를 바란다고 말했다. 박제철 금오공대 교육원장은 교육 프로그램은 학생 중심의 교과, 비교과 프로그램 운영으로 전인교육의 초석을 제공하기 위한 것이라며 공동체 교육을 통해 신입생들에게 대학 문화를 공유하고 창의교육의 모델이 되기를 기대한다고 밝혔다.  . , 네이버 뉴스 스탠드에서도 만나세요 뉴시스 페이스북 트위터 . ."
2017.03.12.,"정보 개방 인색한 국립대…""검색 완전·부분 차단""","검색엔진 배제 선언 평가결과 국립대 29개 중 15곳 웹 개방 미흡 국립대 14곳만 완전 개방 이재은 기자 공공정보가 많은 국립대 웹사이트의 절반 이상51.7이 정보 검색을 완전 또는 부분 차단하는 것으로 나타났다. 웹발전연구소와 한국 인증위원회 는 12일 국립대학교 웹사이트를 대상으로 실시한 검색엔진 배제 선언 평가 결과 이같이 분석됐다고 밝혔다. 이들 기관은 대상 기관 웹사이트의 메인 도메인을 대상으로 검색엔진 차단 여부를 평가했다. 조사 결과에 따르면, 국립대 29개 중 강릉원주대, 경남과학기술대, 공주대, 제주대, 충남대, 충북대, 한국교통대, 한국해양대 등 8개 대학은 정보 검색을 완전히 차단해 웹 개방성이 매우 미흡한 것으로 나타났다. 강원대, 경상대, 목포해양대, 부경대, 서울과학기술대, 서울대, 울산과학기술원 등 7개 대학교 웹사이트는 검색엔진의 정보 검색을 부분적으로 차단해 웹 개방성이 미흡한 것으로 분석됐다. 경북대, 군산대, 금오공과대, 목포대, 부산대, 순천대, 안동대, 인천대, 전남대, 전북대, 창원대, 한경대, 한밭대, 카이스트 등 14개 대학 웹사이트는 정보 검색을 차단하지 않고 전체를 허용해 웹 개방성이 양호한 것으로 조사됐다. 행정자치부와 미래창조과학부는 중앙부처와 지자체 및 그 소속기관과 산하기관 등 모든 대국민 서비스는 개방해야 한다고 강조하고 있다. 이번 평가를 총괄한 숙명여대 정책산업대학원 문형남 교수는 웹사이트에 정보를 공개해 놓고 검색엔진 접근을 차단하는 것은 정보가 많은 웹사이트를 무용지물로 만드는 것이라며 국립대 웹사이트에서 제공하는 공공정보는 높은 가치를 지닌 중요한 자산이다. 검색엔진 접근을 완전히 개방해야 한다고 말했다. 문 교수는 대학이 웹사이트의 정보 검색을 차단한 것은 국민에게 불편을 주고 예산도 낭비하는 것으로 즉시 시정돼야 한다면서 대학 평가 항목에 웹 개방성 항목을 반드시 추가해 반영해야 하고 사립대학들도 웹사이트를 개방해야 한다고 강조했다. . , 네이버 뉴스 스탠드에서도 만나세요 뉴시스 페이스북 트위터 . ."
2017.03.12.,금오공대 기숙 생활 프로그램 호응…신입생 전원 대상 특강`체험 다채,"구미 이창희 기자   금오공과대학교총장 김영식가 신입생 전원을 대상으로 하는 기숙대학 프로그램 제도가 호응을 얻고 있다. 는 신입생 전원이 생활관 입사를 원칙으로 하며, 자기주도 활동을 통해 창의적 역량을 갖춘 인재로 양성하는 게 주목적이다. 올해는 이 프로그램에 신입생 1천267명이 참여했다. 신입생들은 1년간 기숙 생활을 하면서 교과와 비교과로 나눠 진행하는 융합형 인재양성 프로그램 교육을 받는다. 교과 프로그램은 전문가 초청 특강, 에세이 작성 및 독서 인증제 참여 등 종합적인 인성 함양 교육 중심으로, 비교과는 사회봉사 제작외국어 학습합창창업체육예절 등 다양한 체험활동 중심으로 짜여졌다. 지난해 이 프로그램에 참여했던 이지유전자 융합전공 2년 씨는 “ 프로그램이 대학생활의 길잡이가 되어 주었다”면서 “올해 신입생들도 자신이 꿈꾸는 미래 청사진을 그리길 바란다”고 했다. 박제철 금오공대 교육원장은 “ 는 전인교육의 초석을 제공하기 위한 것이며, 창의 교육의 모델이 되길 기대한다”고 밝혔다.  "
2017.03.15.,구미경찰서 하반기에 신청사 착공…2019년 완공," 박순기 기자 경북 구미경찰서가 1년간 지연된 신청사 착공을 올 하반기에 한다. 구미경찰서.  구미경찰서는 지난해 3월 신평동 옛 금오공대 운동장 1만2천㎡에 신청사 공사를 시작할 계획이었으나 예산이 없어 미뤄오다가 올해 285억원을 확보했다. 이달 말까지 실시설계를 완료한 뒤 기획재정부 승인을 받아 하반기에 착공해 2019년 완공할 계획이다. 신청사를 완공하면 경찰서 청사를 송정동에서 신평동으로 이전한다. 신청사는 지하 1층·지상 5층, 연면적 1만2천800㎡이고, 전체 전력의 18를 담당하는 지열·태양광시설을 구비한다. 신청사 지하에는 15ｍ의 13개 사로 권총 사격 연습장을 갖춘다. 송정동 현 경찰서 부지9천㎡는 기획재정부가 매각 또는 활용 방안을 모색할 예정이나 아직 구체적인 방안은 나오지 않았다.  최신 유행 트렌드 총집결 흥클릭"
2017.03.15.,"[사설] 빗나간 대학 신입생 환영 행사, 창조적 파괴 아쉽다","매일신문 대학 입학철을 맞아 대구경북의 대학에서 다양한 신입생 환영 행사가 열리고 있으나 희망보다 걱정이 앞서는 불미스러운 일이 잇따르고 있다. 새 출발과 각오를 다짐하며 학교 선후배 간 교류, 대화와 소통의 시간으로 도움을 주려는 행사의 당초 취지는 퇴색되고 폐해만 부각되고 있다. 신입생 환영 행사의 무용론이 나올 만하다. 대구의 한 대학에서는 신입생 환영회에서 두 시간 동안 벌을 세우고 밥을 먹게 한다거나 문을 잠그고 휴대폰까지 끄도록 했다고 한다. 다른 대학에서는 신입생들에게 술자리 참석과 장기자랑 강요를 비롯한 부당한 일들이 일어나 비판 목소리가 나오고 있다. 대면식이라는 그럴듯한 명분과는 어울리지 않는다. 더욱 심각한 일도 있었다. 포스텍에서는 지난달 27일 행사에서 선배 학생이 신입 여학생 2명을 성폭행, 성추행한 사건으로 가해 학생이 구속됐다. 이에 앞서 지난달 22일 교통사고로 1명이 숨지고 44명이 부상을 입은 구미의 금오공대 신입생 설명회 행사 때는 소주와 맥주 등 7천 병이 넘는 술을 준비했던 것으로 드러나 물의를 빚었다. 이들에게는 공통점이 있다. 먼저 신입생에 대한 배려 실종이다. 신입생은 대학에서의 새 삶의 설계에 부푼 새내기들이다. 낯선 생활에 대한 두려움과 새로운 만남에 대한 설렘이 교차하는 긴장의 순간을 맞고 각종 행사에 참석하는 셈이다. 따라서 이들의 눈높이에 맞춘 살뜰한 배려의 길라잡이가 필요하지 주최 측의 일방적인 주입이나 강요가 필요하지 않다. 뼈아픈 자성이 필요할 때다. 또 지나친 술의 강요다. 술이 낯선 선후배 간의 서먹함이나 어색함을 덜어줄 수 있을지라도 결코 만족스럽지 않음은 수많은 선례들이 증명한다. 그럼에도 금오공대 사례처럼 대학 술 문화는 여전히 논란이다. 옛 사람의 구태를 젊은 세대들이 닮는 꼴이다. 행사를 마련하는 선배 세대의 낡은 틀을 깨는 창조적인 파괴가 절실한 까닭이다. 학교 당국의 방임은 더욱 문제이다. 책임이 담보되지 않는 이런 행사는 자제시키거나 세심한 관심이 마땅하다. 대학의 대학다움, 대학생의 대학생다움을 위해 말이다.  "
